
 CII	BRS : Cross Industry Invoicing Process				 	Header section				 
 	Grouping of Document Details				 
INV-0001	1..1	Invoice identifier	A unique identification for this document.		Exchanged_ Document. Identification. Identifier 
INV-0002	1..1	Issue date	The date, time, date time or other date time value for the issuance of this document.		Exchanged_ Document. Issue. Date Time 
INV-0003	0..1	Document type code	A code specifying a type of document [Reference United Nations Code List (UNCL) 1001 (subset)].	"Specifying the type of the invoice, e.g.:  Commercial invoice   Self-billed invoice   Proforma invoice   Corrected invoice   Credit note – goods and services   Debit note – goods and services   Credit note related to financial adjustments   Debit note related to financial adjustments   Self-billed credit note "	Exchanged_ Document. Type. Code	 					 
INV-0007	0..1	Document Purpose	The purpose, expressed as code, of this document (e.g. Repair Invoice).	"Exchanged Document Category"	Exchanged_ Document. Purpose. Code 
INV-0008	0..1	Document Purpose Information	The purpose, expressed in text, of this document.	Renamed, formerly “Document Information”	Exchanged_ Document. Purpose. Text 
INV-0011	0..1	Document Control Requirement	The indication of whether or not a document has specific control requirements.		Exchanged_ Document. Control Requirement. Indicator 
INV-0313	0..1	Test indicator	The indication of whether or not this exchanged document context is a test.	Added in 16A.1.	Exchanged Document_ Context. Test. Indicator 
INV-0314	0..1	Effective Specified Period	The specified period within which this exchanged document is effective.	Added in 16A.1.	Exchanged_ Document. Effective. Specified_ Period 					 	For additional requirements on document details please refer to CSC-DOC.				 	Grouping of Header Trade Agreement				 
INV-0016	0..1	Seller	The entity contains the details of the seller.	Further details specified in Common BRS (CSC-PAR)	Header_ Trade Agreement. Seller. Trade_ Party 
INV-0017	0..1	Buyer	The entity contains the details of the buyer.	Further details specified in Common BRS (CSC-PAR)	Header_ Trade Agreement. Buyer. Trade_ Party 
INV-0018	0..1	Buyer´s tax representative	The entity contains the details of the tax representative of the buyer.	"Split into Seller and Buyer (see INV-00250) within TBG1 review, originally tax representative, not specified. Details see CSC- PAR"	Header_ Trade Agreement. Buyer_ Tax Representative. Trade_ Party 
INV-0250	0..1	Seller´s tax representative	The entity contains the details of the tax representative of the seller.	"See previous note. Details see CSC-PAR"	Header_ Trade Agreement. Seller_ Tax Representative. Trade_ Party 
INV-0019	0..1	Buyer accountant	"The entity contains the details of the customer accountant."	Changed from Customer to Buyer within TBG1 review. Details see CSC- PAR	Header_ Trade Agreement. Buyer_ Assigned Accountant. Trade_ Party 
INV-0020	0..1	Seller accountant	The entity contains the details of the supplier accountant.	Changed from Supplier to Seller within TBG1 review. Details see CSC-PAR	Header_ Trade Agreement. Seller_ Assigned Accountant. Trade_ Party 
INV-0289	0..*	Requisitioner	A trade party who is a buyer requisitioner in this trade agreement.	"Added during CEFACT Forum Rome by TBG1, 22-Apr-2009 Details see CSC- PAR"	Header_ Trade Agreement. Buyer_ Requisitioner. Trade_ Party
 					 
INV-0021	0..1	Contract document	Reference to contract or agreement document (reference, issue date, involved parties, etc.)	Details see CSC- REF	Header_ Trade Agreement. Contract. Referenced_ Document 
INV-0022	0..1	Quotation document	Reference to quotation document (reference, issue date, involved parties, etc.)	Details see CSC- REF	Header_ Trade Agreement. Quotation. Referenced_ Document 
INV-0023	0..1	Order document (buyer)	Reference to order document of the buyer (reference, issue date, involved parties, etc.)	Buyer added within TBG 1 review. Details see CSC-REF	Header_ Trade Agreement. Buyer_ Order. Referenced_ Document 
INV-0251	0..1	Order document (Seller)	Reference to order document of the seller (reference, issue date, involved parties, etc.)	Added in addition to 
INV-0023 within TBG 1 review. Details see CSC-REF	Header_ Trade Agreement. Seller_ Order. Referenced_ Document 
INV-0024	0..1	Order Response document	Reference to order response document (reference, issue date, involved parties, etc.)	Details see CSC- REF	Header_ Trade Agreement. Order Response. Referenced_ Document 
INV-0025	0..1	Promotional Deal document	Reference to promotional deal document (reference, issue date, involved parties, etc.)	Details see CSC- REF	Header_ Trade Agreement. Promotional Deal. Referenced_ Document 
INV-0026	0..1	Price list document	"Reference to price list document (reference, issue date, involved parties, etc.)"	Details see CSC- REF	Header_ Trade Agreement. Price List. Referenced_ Document 
INV-0027	0..1	Supply instruction document	Reference to supply instruction document (reference, issue date, involved parties, etc.)	Details see CSC- REF	Header_ Trade Agreement. Supply Instruction. Referenced_ Document 
INV-0028	0..1	Demand forecast document	Reference to demand forecast document (reference, issue date, involved parties, etc.)	Details see CSC- REF	Header_ Trade Agreement. Demand Forecast. Referenced_ Document 
INV-0291	0..*	Requisitioner reference	"The requisitioner document referenced in this supply chain trade agreement."	"Added during CEFACT Forum Rome by TBG1, 22-Apr-2009 Details see CSC- REF"	Header_ Trade Agreement. Requisitioner. Referenced_ Document 
INV-0030	0..1	Purchase Conditions	Reference to purchase conditions	Details see CSC- Added in 16A.1	Header_ Trade Agreement. Purchase_ Conditions Referenced_ Document 
INV-0031	0..*	Additional document reference	"Reference to an additional document (reference, issue date, involved parties, etc.)"	Details see CSC- REF	Header_ Trade Agreement. Additional. Referenced_ Document 
INV-0032	0..1	Additional document type	A code specifying a type of referenced document [Reference United Nations Code List (UNCL) 1153].	"Cardinality changed from 0..* to 0..1 as it refers to 
INV- 0031."	Referenced_ Document. Reference_ Type. Code 					 
INV-0033	0..1	Delivery terms	The entity contains the details of the delivery terms and the place if relevant for the delivery terms.	"Includes reference to INCOTERMS"	Header_ Trade Agreement. Applicable. Trade_ Delivery Terms 
INV-311	0..1	Procuring Project	An endeavour carefully planned to achieve a procurement of goods, works and service.	Added in 16A.	Header_ Trade Agreement. Specified. Procuring_ Project 
INV-0315	0..1	Product End User	"The party acting as the end user for the products in this trade agreement."	Added in 16A.1	Header_ Trade Agreement. Product End User. Trade_ Party 
INV-0319	0..*	Reference Text	A reference, expressed as text, for this header trade agreement.	Added in 16A.1	Header_ Trade Agreement. Reference. Text 
INV-0320	0..*	Customer Order reference	A customer order document referenced for this header trade agreement.	Postponed	 					 	Grouping of Header Trade Delivery Details				 
INV-0034	0..1	Delivery date, actual	Date/time on which goods or consignment are delivered at their destination.	Also applicable for service completion date. Includes also the indication of delivery periods.	Header_ Trade Delivery. Actual_ Delivery. Supply Chain_ Event 
INV-0035	0..1	Pick Up date, actual	Pick-up/collection date/time of goods		Header_ Trade Delivery. Actual_ Pick- Up. Supply Chain_ Event 
INV-0036	0..1	Despatch Date, actual	Date/time on which the goods are despatched or shipped.	"Changed to actual during TBG1 review."	Header_ Trade Delivery. Actual_ Despatch. Supply Chain_ Event 
INV-0038	0..*	Despatch advice document	Reference to despatch advice document (reference, issue date, involved parties, etc.)	Details see CSC- REF	Header_ Trade Delivery. Despatch Advice. Referenced_ Document 
INV-0039	0..*	Receiving advice document	Reference to receiving advice document (reference, issue date, etc.)	Cardinality changed in TBG1 review. Details see CSC-REF	Header_ Trade Delivery. Receiving Advice. Referenced_ Document 
INV-0040	0..*	Delivery note document	Reference to delivery note document (reference, issue date, etc.)	Cardinality changed in TBG1 review. Details see CSC-REF	Header_ Trade Delivery. Delivery Note. Referenced_ Document 
INV-0041	0..*	Additional document reference	Reference to additional document (reference, issue date, involved parties, etc.)	e.g., packing list, waybill, bill of lading, consumption report also customs documents like export/import license, goods or services	Header_ Trade Delivery. Additional. Referenced_ Document 
 				declaration, etc. Details see CSC- REF	 
INV-0042	0..1	Additional document type	"A code specifying a type of additional document [Reference United Nations Code List (UNCL) 1153]."	"Cardinality changed from 0..* to 0..1 as it refers to 
INV- 0041."	Referenced_ Document. Reference_ Type. Code 
INV-0043	0..1	Ship to party	The party where the goods or services were delivered or where the service was completed.	Details see CSC- PAR	Header_ Trade Delivery. Ship To. Trade_ Party 
INV-0044	0..1	Ship from party	Party where goods or services are shipped from.	Details see CSC- PAR	Header_ Trade Delivery. Ship From. Trade_ Party 
INV-0045	0..1	Pick up party	Party/Place were goods were picked up by the buyer or his representative	Details see CSC- PAR	Header_ Trade Delivery. Actual_ Pick- Up. Supply Chain_ Event / Supply Chain_ Event. Occurrence. Logistics_ Location 
INV-0046	0..1	Consignor party	Party which, by contract with a carrier, consigns or sends goods with the carrier, or has them conveyed by him. Synonym: shipper, sender.	Details see CSC- PAR	Supply Chain_ Consignment. Consignor. Trade_ Party 
INV-0047	0..1	Consignee party	Party to which goods are consigned.	Details see CSC- PAR	Supply Chain_ Consignment. Consignee. Trade_ Party 
INV-0048	0..1	Ultimate Consignee	Party who has been designated on the invoice or packing list as the final recipient of the stated merchandise.	"Used in cross- docking scenarios Details see CSC-PAR"	Header_ Trade Delivery. Ultimate_ Ship To. Trade_ Party 
INV-0049	0..1	Ultimate Customer	End customer, the final recipient of goods or services.	Used to identify the end consumer. Mapping into Ultimate_ShipTo. Same mapping applies for 0048 and 0049. Details see CSC-PAR	Header_ Trade Delivery. Ultimate_ Ship To. Trade_ Party 
INV-0050	0..1	Country of supply of goods or services	The country from which the delivery has taken place		Trade_ Tax. Service Supply. Trade_ Country 
INV-0051	0..1	Transport mode	The code specifying the mode of transport.		Logistics_ Transport Movement. Mode. Code 
INV-0052	0..1	Transport means	"The entity contains details regarding the transport means (e.g., license plate of the lorry, wagon number, name of the vessel)."	Further details see Common BRS (CSC-TME)	Logistics_ Transport Movement. Used. Logistics_ Transport Means 					 	Grouping of Header Trade Settlement Details				 
INV-0053	0..*	Total to be paid amount	"The monetary value that constitutes the total to be paid on which the trade settlement is calculated."		Trade Settlement Header_ Monetary Summation. Total Prepaid. Amount 
INV-0056	0..*	Total prepaid amount	The monetary value that constitutes the total paid for an advance and on which the trade settlement is calculated.		Trade Settlement Header_ Monetary Summation. Total Prepaid. Amount 
INV-0058	0..*	Total line items amount of the invoice	The monetary value that constitutes the total line items on which the trade settlement is calculated.	"Cardinality changed during TBG 1 review"	Trade Settlement Header_ Monetary Summation. Line Total. Amount 
INV-0059	0..*	Total allowances charges amount of the invoice	The monetary value that constitutes the total allowances charges on which the trade settlement	"Cardinality changed during TBG 1 review"	Trade Settlement Header_ Monetary 
 			is calculated.		Summation. Allowance Total. Amount 
INV-0252	0..*	Total allowances amount of the invoice	The monetary value that constitutes the total allowances on which the trade settlement is calculated.	"Agreed in Paris TBG 1, 28- Aug2008 in addition to 
INV- 0059"	Trade Settlement Header_ Monetary Summation. Allowance Total. Amount 
INV-0253	0..*	Total charges amount of the invoice	The monetary value that constitutes the total charges on which the trade settlement is calculated.	"Agreed in Paris TBG 1, 28- Aug2008 in addition to 
INV- 0059"	Trade Settlement Header_ Monetary Summation. Charge Total. Amount 
INV-0060	0..*	Total amount	"The monetary value that constitutes the total invoice or credit note on which the trade settlement is calculated."	"Renamed to Total amount from Total invoice amount in order to cover invoice and credit note amount."	Trade Settlement Header_ Monetary Summation. Grand Total. Amount 
INV-0061	0..*	Total tax amount of the invoice	The monetary value that constitutes the total tax on which the trade settlement is calculated.		Trade Settlement Header_ Monetary Summation. Tax Total. Amount 
INV-0062	0..*	Total tax basis amount of the invoice	The monetary value that constitutes the total tax basis on which the trade settlement is calculated.		Trade Settlement Header_ Monetary Summation. Tax Basis Total. Amount 
INV-0063	0..*	Total rounding amount	The monetary value that constitutes the total rounding on which the trade settlement is calculated.		Trade Settlement Header_ Monetary Summation. Rounding. Amount 
INV-0064	0..*	Total Information amount	The monetary value that constitutes the information total on	Can be used for the monetary value that	Trade Settlement 
 			which the trade settlement is calculated.	"constitutes the total of a previous invoice to be paid. Code list needs to be developed (based on DE 5025) •      Total retail value •      Total returnable items deposit amount • Calculation basis excluding all taxes • Calculation basis including all taxes except VAT •      Message total duty/tax/fee amount"	Header_ Monetary Summation. Information. Amount 					 					 
INV-0065	0..1	Total amount subject to payment discount	Part of the invoice amount which is subject to payment discount.		Trade_ Payment Discount Terms. Actual Discount. Amount 
INV-0067	0..*	Adjustment	Specifying the adjustment.	Includes amount, reason, etc.	Header_ Trade Delivery. Specified. Delivery_ Adjustment 
INV-0068	0..1	Credit reason	Reason why credit was issued in credit note	Added in 10A.	Header_ Trade Settlement. Credit Reason. Code / Header_ Trade Settlement. Credit Reason. Text 
INV-0069	0..1	Tax point date	The date of the tax point when taxes are or will be applicable.	"covered within CSC-Tax within Common BRS"	Applied_ Tax. Tax Point. Date 
INV-0280	0..1	Tax due date code	A code indicating when the duty, tax, or fee payment will be due.	"Refer to EDIFACT, DE 5307. Added during CEFACT Forum Rome, 22-Apr-2009."	Trade_ Payment Terms. Due Date. Date Time 
INV-0070	0..1	Billing period	"A specific period of time such as the length of time between two known date/time points, from a start date onwards, or up to an end date."		Header_ Trade Settlement. Billing. Specified_ Period 
INV-0071	0..1	Invoicer party	"The invoicer is the person or organization making the invoice, claiming payment for the goods or services rendered."	Details see CSC- PAR	Header_ Trade Settlement. Invoicer. Trade_ Party 
INV-0072	0..1	Invoicee party	The invoicee party is the person or organization who will receive the invoice for the delivery of products or services.	Details see CSC- PAR	Header_ Trade Settlement. Invoicee. Trade_ Party 
INV-0073	0..1	Payer party	The payer is the person or organization responsible for the payment.	Details see CSC- PAR	Header_ Trade Settlement. Payer. Trade_ Party 
INV-0074	0..*	Payee party	The payee party is the person or organization to whom a payment should be or is made.	"Cardinality 0..* means that various payees can occur in one invoice, related to Payment Means and Payment Terms. The cardinality of 0..* needs further discussion. In 09A only a cardinality of 0..1 will be supported. Details see CSC- PAR"	Header_ Trade Settlement. Payee. Trade_ Party 
INV-0079	0..1	Invoice document	"Reference to invoice document (reference, issue date, involved parties, etc.) of a previously sent invoice"	Details see CSC- REF	Header_ Trade Settlement. Invoice. Referenced_ Document 
INV-0080	0..1	Pro-forma invoice document	Reference to pro- forma invoice document (reference, issue date, involved	Details see CSC- REF	Header_ Trade Settlement. Pro-Forma Invoice. 
 			parties, etc.)		Referenced_ Document 
INV-0081	0..1	Letter of credit reference	"Reference to a letter of credit document. This requirement refers to Stand-By Letter of Credit, also called Documentary Credit in Anglo- American."	"The Stand-By Letter of Credit is a guarantee of payment. Definition changed (see INV0082). Details see CSC- REF"	Header_ Trade Settlement. Letter Of Credit. Referenced_ Document 
INV-0083	0..*	Applicable Tax	"A levy or payment for the support of a government required of persons, groups, or businesses within the domain of that government."	"Further details see Common BRS (CSC-TAX) Note: Includes Place of Supply"	Header_ Trade Settlement. Applicable. Trade_ Tax 
INV-0316	0..*	Tax - Line Total Basis. Amount	"A monetary value used as the line total basis on which this trade related tax, levy or duty is calculated."	Added in 16A.1	Trade_ Tax. Line Total_ Basis. Amount 
INV-0317	0..*	Tax - Allowance Charge_ Basis. Amount	A monetary value used as the allowance and charge basis on which this trade related tax, levy or duty is calculated.	Added in 16A.1	Trade_ Tax. Allowance Charge_ Basis. Amount 
INV-0256	0..*	Calculated Tax	The calculated tax for the invoice.	Added in TBG 1 review. Further details see Common BRS (CSC-TAX)	Header_ Trade Settlement. Subtotal_ Calculated. Trade_ Tax 
INV-0257	0..*	Tax scheme	Specifying the tax scheme for the calculated or applicable tax.	Added in TBG 1 review. Further details see Common BRS (CSC-TXS)	Trade_ Tax. Category. Code 
INV-0088	0..*	Tax basis amount per rate	Total taxable amount for the given tax rate and tax category	"May 2009: Implemented as Subtotal_ Calculated. Trade_ Tax. For further details see Common BRS (CSC-TAX)."	Applied_ Tax. Details / Applied_ Tax. Basis. Amount 
INV-0089	0..*	Tax amount per rate	The total amount of tax per tax rate and tax category	"May 2009: Implemented as Subtotal_ Calculated. Trade_ Tax. For further details see Common BRS (CSC-TAX)."	Trade Settlement Header_ Monetary Summation. Tax Total. Amount 
INV-0090	0..*	Tax amount per rate in VAT currency	"The total amount of tax per tax rate and tax category in VAT currency"	"May 2009: Implemented as Subtotal_ Calculated. Trade_ Tax. For further details see Common BRS (CSC-TAX)."	Header_ Trade Settlement. Tax_ Currency. Code / Trade_ Tax. Category. Code 
INV-0091	0..*	Total allowances/charges amount per tax rate	Total allowances / charges amount per tax rate and category	"May 2009: Implemented as Subtotal_ Calculated. Trade_ Tax. For further details see Common BRS (CSC-TAX). Not covered in 09A, moved to 09B."	Line_ Trade Settlement. Specified. Trade_ Allowance Charge 
INV-0092	0..*	Total of all line item amounts per tax rate	Sum of all line item amounts per tax rate and category	"May 2009: Implemented as Subtotal_ Calculated. Trade_ Tax. For further details see Common BRS (CSC-TAX). Not covered in 09A, moved to 09B."	Header_ Trade Settlement. Specified. Trade Settlement Header_ Monetary Summation 
INV-0258	0..*	Payment Terms	Specifying payment terms for this document.	Added during TBG1 review to align with Common BRS. Further details see Common BRS (CSC-PYT) Note: Includes reference to direct debit mandate.	Header_ Trade Settlement. Specified. Trade_ Payment Terms 
INV-0097	0..1	Payment Terms Discount Due Date	"Date by which payment should be made if discount terms are to apply."		Header_ Trade Settlement. Specified. Trade_ Payment Terms 
 					Trade_ Payment Terms. Due Date. Date Time 
INV-0103	0..*	Payment Means	A payment means specified for this trade settlement.	"Usage of DE 4461 (Cheque, cash, bank account etc.) Including Accounts of payer, payee. Further details in Common. Supply Chain BRS. (CSC-PYM)"	Header_ Trade Settlement. Specified. Trade Settlement_ Payment Means 
INV-0104	0..*	Allowance and/or charge details	Details regarding allowances and charges	Further details in Common Supply Chain BRS. (CSC-ALC)	Header_ Trade Settlement. Specified. Trade_ Allowance Charge 
INV-0105	0..*	Allowance and/or charge rate	Rate per unit which the allowance or charge applies, e.g., the allowance/charge amount is 3 EUR per 10 tons.	Added in 09A.	Header_ Trade Settlement. Specified. Trade_ Allowance Charge. Calculation. Percent 
INV-0106	0..*	Allowance and/or charge rate basis	Basis for the rate per unit which the allowance or charge applies, e.g., the allowance/charge amount is 3 EUR per 10 tons.	Added in 09A.	Header_ Trade Settlement. Specified. Trade_ Allowance Charge. Basis. Amount / Header_ Trade Settlement. Specified. Trade_ Allowance Charge. Unit_ Basis. Amount 
INV-0107	0..*	Freight Charge	Charge for freight	If not included in allowances and charges	Supply Chain_ Consignment. Total Charge. Amount 
INV-0108	0..1	Invoice Currency	The name or symbol of the monetary unit used for calculation in an invoice.		Header_ Trade Settlement. Invoice_ Applicable. Trade_ Currency Exchange 
INV-0109	0..1	Tax Currency	The name or symbol of the monetary unit used for tax purposes.		Header_ Trade Settlement. Tax_ Applicable. Trade_ Currency Exchange 
INV-0110	0..1	Payment Currency	The name or symbol of the monetary unit used for payment.		Header_ Trade Settlement. Payment_ Applicable. Trade_ Currency Exchange 
INV-0263	0..1	Creditor Reference	The unique identifier of the creditor reference for this trade settlement, such as a specific identifier assigned by the creditor to refer to the financial transaction.	Added during TBG steering review Oct-2008.	Header_ Trade Settlement. Creditor Reference. Identifier 
INV-0270	0..1	Reconciliation Reference ID	"The unique identifier of the payment instruction, such as assigned by an instructing party for an instructed party to unambiguously identify the instruction."	"Added during CEFACT Forum Rome 22-Apr- 2009, requested by TBG 5"	Header_ Trade Settlement. Payment Reference. Text 
INV-0272	0..*	Payable Accounting Account	A payable accounting account specified for this trade settlement.	"Added during CEFACT Forum Rome 22-Apr- 2009,in agreement with TBG 12"	Header_ Trade Settlement. Payable_ Specified. Trade_ Accounting Account 
INV-0273	0..*	Receivable Accounting Account	A receivable accounting account specified for this trade settlement.	"Added during CEFACT Forum Rome 22-Apr- 2009,in agreement with TBG 12"	Header_ Trade Settlement. Receivable_ Specified. Trade_ Accounting Account 
INV-0274	0..*	Purchase Accounting Account	A purchase accounting account specified for this trade settlement.	"Added during CEFACT Forum Rome 22-Apr- 2009,in agreement with TBG 12"	Header_ Trade Settlement. Purchase_ Specified. Trade_ Accounting Account 
INV-0275	0..*	Sales Accounting Account	A sales accounting account specified for this trade settlement.	"Added during CEFACT Forum Rome 22-Apr- 2009,in agreement with TBG 12"	Header_ Trade Settlement. Sales_ Specified. Trade_ Accounting Account 
INV-0281	0..1	Factoring Agreement	Reference to a underlying factoring agreement between invoice seller and factoring service provider.	"Added during CEFACT Forum Rome 22-Apr- 2009, in agreement with TBG 5. Details see CSC-REF"	Header_ Trade Settlement. Factoring Agreement. Referenced_ Document 
INV-0282	0..1	Factoring List	Reference to a factoring transmission list. This list contains identification information of factored invoices.	"Added during CEFACT Forum Rome 22-Apr- 2009,in agreement with TBG 5 Details see CSC-REF"	Header_ Trade Settlement. Factoring List. Referenced_ Document 
INV-0293	0..*	Financial Card Details	Details to a financial card related to this trade settlement.	"Requirements reflected by CSCFCA in Common BRS. Added during CEFACT Forum Rome 22-Apr- 2009, in agreement with TBG 5"	Header_ Trade Settlement. Specified. Trade Settlement_ Financial Card Line Section					Supply Chain_ Trade Line Item. Details 	Grouping of Document Line Details				 
INV-0112	0..1	Invoice line number	"The unique reference given by the issuer to identify an invoice line within an invoice"		Document Line_ Document. Line. Identifier 
INV-0113	0..1	Invoice line status code	The code specifying the status of this document line.		Document Line_ Document. Line Status. Code 
INV-0114	0..1	Invoice line status reason code	The code specifying the reason for the status of this document line.		Document Line_ Document. Line Status Reason. Code 
INV-0115	0..*	Invoice line note	The free text information related to the invoice line.		Document Line_ Document. Included. Note 
INV-0116	0..1	Invoice parent line reference	Reference to the parent line, used in order to provide sublines of the line item.	Added in 10A.	Document Line_ Document. Parent_ Line. Identifier 
INV-0295	0..1	Line item description code	A code specifying the type of trade item e.g., invoicing unit, consumer unit etc.	Added in 16A1	Supply Chain_ Trade Line Item. Description. Code 
INV-0296	0..*	Sub-Line Item	"A collection of information specific for a line breakdown (a constituent part of a product)."	Added in 12B.	Subordinate_ Trade Line Item. Details 
