seq	code	general	level	module	term	ID	label	description	Card	dataType
201	cen-138		6	cen	invoiceLineAllowancePercentage	BT-138	Invoice line allowance percentage	The percentage that may be used, in conjunction with the Invoice line allowance base amount, to calculate the Invoice line allowance amount	0..1	percentageItemType
202	cen-139		6	cen	invoiceLineAllowanceReason	BT-139	Invoice line allowance reason	The reason for the Invoice line allowance, expressed as text.	0..1	textItemType
203	cen-140		6	cen	invoiceLineAllowanceReasonCode	BT-140	Invoice line allowance reason code	The reason for the Invoice line allowance, expressed as a code.\nUse entries of the UNTDID 5189 code list [6]. The Invoice line level allowance reason code and the Invoice line level allowance reason shall indicate the same allowance reason.	0..1	codeItemType
204	cenG-28		5	cen	invoiceLineCharges	BG-28	INVOICE LINE CHARGES	A group of business terms providing information about charges and taxes other than VAT applicable to the individual Invoice line.\nAll charges and taxes are assumed to be liable to the same VAT rate as the Invoice line.	0..n	
205	cen-142		6	cen	invoiceLineChargeBaseAmount	BT-142	Invoice line charge base amount	The base amount that may be used, in conjunction with the Invoice line charge percentage, to calculate the Invoice line charge amount.	0..1	amountItemType
206	cen-143		6	cen	invoiceLineChargePercentage	BT-143	Invoice line charge percentage	The percentage that may be used, in conjunction with the Invoice line charge base amount, to calculate the Invoice line charge amount.	0..1	percentageItemType
207	cen-144		6	cen	invoiceLineChargeReason	BT-144	Invoice line charge reason	The reason for the Invoice line charge, expressed as text.	0..1	textItemType
208	cen-145		6	cen	invoiceLineChargeReasonCode	BT-145	Invoice line charge reason code	The reason for the Invoice line charge, expressed as a code.\nUse entries of the UNTDID 7161 code list [6]. The Invoice line charge reason code and the Invoice line charge reason shall indicate the same charge reason.	0..1	codeItemType
209	cen-154		6	cen	itemDescription	BT-154	Item description	A description for an item.\nThe Item description allows for describing the item and its features in more detail than the Item name.	0..1	textItemType
210	cenG-32		4	cen	itemAttributes	BG-32	ITEM ATTRIBUTES	A group of business terms providing information about properties of the goods and services invoiced.	0..n	
211	cen-160		5	cen	itemAttributeName	BT-160	Item attribute name	The name of the attribute or property of the item.\nSuch as 'Colour'.	1..1	textItemType
212	cen-161		5	cen	itemAttributeValue	BT-161	Item attribute value	The value of the attribute or property of the item.\nSuch as 'Red'.	1..1	textItemType