code	seq	level	module	term	type	label	description	label-ja	description-ja
bus-126	350	6	bus	identifierCity	identifierCityItemType	City	City	CVE住所都市	都市。
bus-127	351	6	bus	identifierStateOrProvince	identifierStateOrProvinceItemType	State or Province	State or province	CVE住所州	州や地方。
bus-128	352	6	bus	identifierCountry	identifierCountryItemType	Country	Country	CVE住所国	国。
bus-129	353	6	bus	identifierZipOrPostalCode	identifierZipOrPostalCodeItemType	Zip or Postal Code	Zip or other postal code	CVE住所郵便番号	郵便番号。
bus-130	354	6	bus	identifierAddressLocationIdentifier	locationIdentifierItemType	Identifier Address Location ID	A code used to identify the identifier and to associate it with contacts	CVE所在地識別子	CVE識別子を識別したり、担当者と関係付けるコード。
corG-14	355	5	cor	identifierContactInformationStructure	_	Identifier Contact Information Structure	Identifier Contact Information Structure	【CVE担当者情報】	CVE識別子の担当者情報の構造体。
cor-59	356	6	cor	identifierContactPrefix	identifierContactPrefixItemType	Identifier Contact Prefix	Prefix (e.g. Dr., Mr., Mrs.)	CVE担当者敬称	敬称(Dr.、Mr.、Mrs.など)
cor-60	357	6	cor	identifierContactLastName	identifierContactLastNameItemType	Identifier Contact Last Name	Identifier Contact Last or Family Name	CVE担当者姓	CVE識別子の担当者の姓
cor-61	358	6	cor	identifierContactFirstName	identifierContactFirstNameItemType	Identifier Contact First Name	First or given name	CVE担当者名	名、クリスチャンネーム
cor-62	359	6	cor	identifierContactSuffix	identifierContactSuffixItemType	Identifier Contact Suffix	Suffix (e.g. MD, CPA, Jr.)	CVE担当者付加名称\n	付加名称(MD、CPA、Jr.など)
cor-63	360	6	cor	identifierContactAttentionLine	identifierContactAttentionLineItemType	Identifier Contact Attention Line	Attention Line	CVE担当者アテンションライン	アテンションライン
cor-64	361	6	cor	identifierContactPositionRole	identifierContactPositionRoleItemType	Identifier Contact Position/Role	Position or Role	CVE担当者地位/役職	地位や役職
corG-15	362	6	cor	identifierContactPhone	_	Identifier Contact Phone	Phone Number	【CVE担当者電話番号】	電話番号
cor-65	363	7	cor	identifierContactPhoneNumberDescription	gl-gen:phoneNumberDescriptionItemType	Identifier Contact Phone Number Usage	Identifier Contact Phone Number Usage (Main, Investor Relations, etc.)	CVE担当者電話番号用途	CVE識別子の担当者の電話番号の用途。(代表、IR用など)\n[設定値のリスト]\n(bookkeeper：記帳係)、(controller：会計責任者)、(direct：直通)、(fax：FAX)、(investor-relations：IR担当者)、(main：代表)、(switchboard：交換台)、(other：その他) 
cor-66	364	7	cor	identifierContactPhoneNumber	gl-gen:phoneNumberItemType	Identifier Contact Phone Number	Identifier Contact Phone Number	CVE担当者電話番号	CVE識別子の担当者の電話番号。
corG-16	365	6	cor	identifierContactFax	_	Identifier Contact Fax Number	Fax Number	【CVE担当者FAX番号】	FAX番号。
cor-67	366	7	cor	identifierContactFaxNumberUsage	gl-gen:faxNumberUsageItemType	Identifer Contact Fax Number Usage	Identifer Contact Fax Number Usage (e.g. Orders, Head Office, IR)	CVE担当者FAX番号用途	CVE識別子の担当者のFAX番号の用途。(注文、本社、IRなど)
cor-68	367	7	cor	identifierContactFaxNumber	gl-gen:faxNumberItemType	Identifer Contact Fax Number	Identifer Contact Fax Number	CVE担当者FAX番号	CVE識別子の担当者のFAX番号。
corG-17	368	6	cor	identifierContactEmail	_	Identifier Contact Email Address	Email Address	【CVE担当者Eメールアドレス】	Eメールアドレス。
cor-69	369	7	cor	identifierContactEmailAddressUsage	gl-gen:emailAddressUsageItemType	Identifer Contact Email Address Usage	Identifer Contact Email Address Usage (e.g. Orders, Head Office, IR)	CVE担当者Eメールアドレス用途	CVE識別子の担当者のEメールアドレスの用途。(注文、本社、IRなど)
cor-70	370	7	cor	identifierContactEmailAddress	gl-gen:emailAddressItemType	Identifer Contact Email Address	Identifer Contact Email Address	CVE担当者Eメールアドレス	CVE識別子の担当者のEメールアドレス。
cen-34	371	6	cen	ElectronicAddress	textItemType	Electronic address	Identifies the electronic address to which the application level response to the invoice may be delivered.		
cor-71	372	6	cor	identifierContactType	identifierContactTypeItemType	Identifier Contact Type	Identifier Contact Type	CVE担当者種別	CVE識別子の担当者の種別
bus-131	373	6	bus	identifierLocationIdentifierCrossReference	locationIdentifierItemType	Identifier Address Location ID Cross Reference	This code is used to associate the contact with a specific location for the Identifier. Its value should be the same as that of the identifierAddressLocationIdentifier	CVE所在地相互参照情報	担当者とCVE識別子の所在地を関係付けるためのコード。identifierAddressLocationIdentifierと同じ値であるべき。
cor-72	374	5	cor	identifierActive	gl-gen:activeItemType	Identifier Active	Boolean to indicate whether the identifier is active (="true") or inactive (="false")	CVE有効性	CVE識別子が有効か無効かを示すブール値。
cor-73	375	4	cor	documentType	gl-gen:documentTypeItemType	Document Type	An enumerated field describing the original source document, with invoice, voucher, check and other enumerated entries	元文書種別	顧客への請求書、ベンダからの請求書、小切手、その他の列挙値による、元文書の説明。\n[設定値のリスト]\n(check：小切手)、(debit-memo：借方メモ)、(credit-memo：貸方メモ)、(finance-charge：財務費用)、(invoice：顧客への請求書)、(order-customer：顧客オーダ)、(order-vendor：仕入先オーダ)、(payment-other：その他支払い)、(reminder：督促状)、(tegata：手形)、(voucher：ベンダからの請求書)、(shipment：出荷票)、(receipt：受領票)、(manual-adjustment：手修正)、(other：その他)
cor-74	376	4	cor	documentTypeDescription	documentTypeDescriptionItemType	Document Type Description	Free format description of the document type	元文書種別説明	元文書の種別の説明。
cor-75	377	4	cor	invoiceType	gl-gen:invoiceTypeItemType	Invoice Type	Invoice Type  (self-billed, ePoS enumerated values)	請求書種別	請求書の種別。(self-billed、ePoS)\n[設定値のリスト]\n(ePos：POSシステムからの発行)、(self-billed：手動発行)
cor-76	378	4	cor	documentNumber	documentNumberItemType	Document Number	Invoice, check, voucher, or other source document identifier	元文書番号	請求書、小切手、証憑、その他の元文書の識別子。
cor-77	379	4	cor	documentApplyToNumber	documentApplyToNumberItemType	Apply To Number	Document number of primary invoice number, used to offset payments, debits and credits; for an invoice, usually the same as the documentNumber. When calculating open balance on an invoice, or open amount on payments in advance or not fully applied, this permits calculation of the open item.	適用先番号	支払、借方、貸方の相殺に使用される、一次請求書の文書番号。請求書では通常documentNumberと等しい。未決済の請求書残高や、未決済の支払金額の計算時に、利用できる。
cor-78	380	4	cor	documentReference	documentReferenceItemType	Document Reference	Internal reference for the document above; number assigned internally to track the document	元文書参照情報	上の文書のための内部参照情報。文書を追跡するために内部的に割り当てた番号。
cor-79	381	4	cor	documentDate	documentDateItemType	Document Date	Date (and less likely in the paper world but possible in the e-world, time) on actual document (invoice, voucher, check date). Other dates control posting information.	元文書日付	実際の文書（請求書、証憑、小切手）の日付（および、紙の世界ではありそうにないが、電子的には時刻）。 転記の情報は別の日付で管理する。
bus-132	382	4	bus	documentReceivedDate	documentReceivedDateItemType	Received Date	Date/time document was noted as received (if necessary). Represents actual date received. Posting dates are maintained separately.	元文書受領日付	（必要であれば）文書の受領が記録された日付/時刻。実際に受領された日付をあらわす。転記日付は別に管理される。
bus-133	383	4	bus	documentChargeReimb	documentChargeReimbItemType	Chargeable or Reimbursable	Is this entry chargeable to client, reimbursable? Used by some systems to indicate that account on posting/validation should be posted to a customer or vendor's account.	請求支払可能フラグ	この仕訳は顧客に請求、支払可能か。いくつかのシステムでは転記/検証対象の科目が顧客や仕入先の科目に転記されるべきかどうかを示すために使用される。
bus-134	384	4	bus	documentLocation	documentLocationItemType	Document Location	Document location as URI, file name or other reference. Alternatively, text of document can be placed here.	元文書格納場所	文書の格納場所である、URI、ファイル名またはその他の参照情報。代わりに、文書のテキストも記述可能。
bus-135	385	4	bus	paymentMethod	paymentMethodItemType	Payment Method	Method used or to be used to make the payment	支払方法	支払いのために使用された、または使用される方法。
cor-80	386	4	cor	postingStatus	gl-gen:postingStatusItemType	Posting Status	deferred: although entered, it cannot be posted until a later time\nposted: already posted\nproposed: a proposed item that must be approved\nsimulated: a simulated item, for what-if\ntax: a tax-specific entry\nunposted:entered but not yet posted or validated\ncancelled:entered and later cancelled\nother:other status - should be described in postingStatusDescription	転記状態	・据置：入力されたが、まだ転記できない。\n・転記済：転記済み。\n・提案済：検証が必要な項目。\n・シミュレーション：仮定のためにシミュレートされた項目。\n・税：税項目。\n・未転記：入力されたが、まだ検証も転記もされていない。\n・取消済：入力されたが、取り消された。\n・その他：その他の状態。postingStatusDescriptionで説明されるべき。\n[設定値のリスト]\n(deferred：据置)、(posted：転記済)、(proposed：提案済)、(simulated：シミュレーション)、(tax：税)、(unposted：未転記)、(cancelled：取消済)、(other：その他)
cor-81	387	4	cor	postingStatusDescription	postingStatusDescriptionItemType	Posting Status Description	Free format description of the posting status	転記状態説明	転記状態の説明。
corG-18	388	4	cor	xbrlInfo	_	XBRL Information	This will roll up to XBRL reporting information - this is a parent - repeatable so that the same item can be reported through many taxonomies. Care should be taken to consider what happens if people post to the same account but different XBRL elements.	【XBRL情報】	XBRLレポート情報へのロールアップ情報。親タグであり、同じ項目が複数のタクソノミを通じて報告されうるように繰り返し可能。同一の勘定科目を異なるXBRL要素に転記した場合にどうなるか、注意深く考慮すべきである。
cor-82	389	5	cor	xbrlInclude	gl-gen:xbrlIncludeItemType	XBRL Allocation	Indicates that the information being given is beginning_balance, ending_balance, period_change.	XBRL割当	与えられた情報が、期首残高、期末残高、期中増減のいずれであるかを示す。\n[設定値のリスト]\n(beginning_balance：期首残高)、(ending_balance：期末残高)、(period_change：期中増減)
cor-83	390	5	cor	summaryReportingElement	summaryReportingElementItemType	Summary Reporting Element	Associated XBRL element or XML element within an XML taxonomy - mapping to an XBRL concept.	集約報告エレメント	関係付けられた、XMLタクソノミ中のXBRL要素または、XML要素。XBRLコンセプトへのマッピング。
cor-84	391	5	cor	detailMatchingElement	detailMatchingElementItemType	Detail Matching Element	Associated XBRL element in XBRL-GL instance.	明細対応エレメント	関係付けられた、XBRL-GLインスタンス中のXBRL要素。
srcd-5	392	5	srcd	summaryTuplePath	summaryTuplePathItemType	Summary Tuple Path	Specific filter for parent tuple structure. This value must be valid XPath. And the result of the XPath must be resolved to a node.	集約タプルパス	親タグ構造を特定するフィルタ。妥当なXPath記述でなければならない。XPathの結果はノードでなければならない。
srcd-6	393	5	srcd	detailedContentFilter	detailedContentFilterItemType	Detailed Content Filter	Filtering mechanism. This value must be valid XPath. And the result of the XPath must be resolved to boolean. If the resulting value is false, the entry  must not mapped into specified facts in F/S.	明細コンテントフィルタ	フィルタリング手段。妥当なXPath記述でなければならない。XPathの結果はブール値でなければならない。結果がfalseの場合は、仕訳はF/S内の特定のfactsにマッピングされてはならない。
srcd-7	394	5	srcd	reportingDateSelector	reportingDateSelectorItemType	Reporting Date Selector	This holds the concepts in GL data to create FS contexts.  The value must be a list of QName. Each QName must be resolved to GL items. Order of the items defines priority to access.	報告日付セレクタ	F/Sのコンテキストを生成するためのGLデータの概念を示す。QNameのリストでなければならない。個々のQNameはGL項目を示さなければならない。項目の並びはアクセスの優先度を示す。
srcdG-2	395	5	srcd	summaryPrecisionDecimals	_	Summary Precision Decimals	This structure allows to explicitly indicate the value for the precision or decimals attributes for a fact in an FR instance. Only one of the four elements in the structure has to be used.	【集約有効桁数】	集約の有効桁数と小数部有効桁数の記述の指定場所。
srcd-8	396	6	srcd	summaryPrecision	summaryPrecisionItemType	Summary Precision	This item indicates that the fact in the FR instance has a precision attribute with the value specified in this item value.	集約有効桁数	集約の有効桁数の記述の指定場所。
srcd-9	397	6	srcd	summaryPrecisionINF	summaryPrecisionINFItemType	Summary Precision INF	This item, when used, has no value. Its only presence indicates that the fact in the FR instance  has a precision attribute  and its value is INF.	集約有効桁数無限	F/Sが、有効桁数属性を持っており、その値がINF(無限大)であること示す。
srcd-10	398	6	srcd	summaryDecimals	summaryDecimalsItemType	Summary Decimals	This item indicates that the fact in the FR instance has a decimals attribute with the value specified in this item value.	集約小数部有効桁数	F/Sが、ここで指定する値の小数部有効桁数属性を持っていることを示す。
srcd-11	399	6	srcd	summaryDecimalsINF	summaryDecimalsINFItemType	Summary Decimals INF	This item, when used, has no value. Its only presence indicates that the fact in the FR instance  has a decimals attribute  and its value is INF.	集約小数部有効桁数無限	F/Sが、小数部有効桁数属性を持っており、その値がINF(無限大)であることを示す。
srcdG-3	400	5	srcd	summaryContext	_	Summary Context	This structure allows to explicitly indicate the context information for a fact in the FR instance.	【集約コンテキスト】	集約のコンテキストの記述の指定場所。
srcdG-4	401	6	srcd	summaryEntity	_	Summary Entity	This structure allows to explicitly indicate the entity information for a fact in the FR instance.	【集約エンティティ】	集約のエンティティの記述の指定場所。
srcd-12	402	7	srcd	summaryIdentifier	summaryIdentifierItemType	Summary Entity Identifier	The value of the entity identifier.	集約エンティティ識別子	集約のエンティティ識別子の記述の指定場所。
srcd-13	403	7	srcd	summaryScheme	summarySchemeItemType	Summary Entity Scheme	The value of the entity scheme.	集約エンティティスキーム	集約のエンティティスキームの記述の指定場所。
srcdG-5	404	7	srcd	summarySegment	_	Summary Entity Segment	This structure allows to explicitly indicate the information related to the segment in the context for a fact in the FR instance.	【集約エンティティセグメント】	集約のエンティティセグメントの記述の指定場所。
srcdG-6	405	8	srcd	segmentExplicit	_	Segment Explicit	This structure allows to explicitly indicate the information related to an explicit dimension in the context for a fact in the FR instance.	【集約エクスプリシットディメンション】	集約のエクスプリシットディメンションの記述の指定場所。
srcd-14	406	9	srcd	segmentExplicitDimension	segmentExplicitDimensionItemType	Segment Explicit Dimension	The QName value must be resolved to a valid dimension item.	集約ディメンション	QNameの値は妥当なディメンション項目を示さなければならない。
srcd-15	407	9	srcd	segmentExplicitDimensionValue	segmentExplicitDimensionValueItemType	Segment Explicit Dimension Value	The QName value must be resolved to valid member item.	集約エクスプリシットディメンション値	QNameの値は妥当なメンバ項目を示さなければならない。
srcdG-7	408	8	srcd	segmentTyped	_	Segment Typed	This structure allows to explicitly indicate the information related to a typed dimension in the context for a fact in the FR instance.	【集約タイプトディメンション】	集約のタイプトディメンションの記述の指定場所。
srcd-16	409	9	srcd	segmentTypedDimension	segmentTypedDimensionItemType	Segment Typed Dimension	The QName value must be resolved to a valid dimension item.	集約ディメンション	QNameの値は妥当なディメンション項目を示さなければならない。
srcd-17	410	9	srcd	segmentTypedDimensionValue	segmentTypedDimensionValueItemType	Segment Typed Dimension Value	The value must be CDATA and a valid XML fragment and also schema valid against an appropriate typed dimension schema.	集約タイプトディメンション値	CDATAであり、妥当なXML記述でなければならない。スキーマは、入力されたディメンションスキーマに対して妥当でなければならない。
srcdG-8	411	8	srcd	segmentSimpleElement	_	Segment Simple Element	This structure allows to explicitly indicate the information related to a simple elemtn in the context for a fact in the FR instance.	【集約シンプルエレメントコンテント】	セグメントまたはシナリオの、空要素を表現するためのタプル。
srcd-18	412	9	srcd	segmentSimpleElementContent	segmentSimpleElementContentItemType	Segment Simple Element Content	QName for the simple element, if appropriate.	集約シンプルエレメント名	集約シンプルエレメントの記述のQName
srcd-19	413	9	srcd	segmentSimpleElementValue	segmentSimpleElementValueItemType	Segment Simple Element Value	The value of the simple element.	集約シンプルエレメント値	シンプルエレメントの値。
srcd-20	414	8	srcd	segmentNonDimensionalContents	segmentNonDimensionalContentsItemType	Segment Non Dimensional Contents	The value must be CDATA and a valid XML fragment.	集約非ディメンションコンテント	CDATAであり、妥当なXML記述でなければならない。
srcdG-9	415	6	srcd	summaryPeriod	_	Summary Period	This structure allows to explicitly indicate the period information for a fact in the FR instance. Instant, Period Start/End and Forever are alternative.	【集約ピリオド】	集約のピリオドの記述の指定場所。
srcd-21	416	7	srcd	summaryInstant	summaryInstantItemType	Summary Period Instant	The value of the instant date.	集約ピリオドインスタント	集約のピリオドの特定の日付の記述の指定場所。
srcd-22	417	7	srcd	summaryStartDate	summaryStartDateItemType	Summary Period Start Date	The value of the start date of the period.	集約ピリオド開始日付	集約のピリオドの開始日の記述の指定場所。
srcd-23	418	7	srcd	summaryEndDate	summaryEndDateItemType	Summary Period End Date	The value of the end date of the period.	集約ピリオド終了日付	集約のピリオドの終了日の記述の指定場所。
srcd-24	419	7	srcd	summaryForever	summaryForeverItemType	Summary Period Forever	If the context should indicate "forever", this concept must be used. It accepts no value.	集約ピリオド無期限	集約のピリオドが無期限であることを示す指定場所。
srcdG-10	420	6	srcd	summaryScenario	_	Summary Scenario	This structure allows to explicitly indicate the scenario information for a fact in the FR instance.	【集約シナリオ】	集約のシナリオの記述の指定場所。
srcdG-11	421	7	srcd	senarioExplicit	_	Senario Explicit	This structure allows to explicitly indicate the information related to an explicit dimension in the context for a fact in the FR instance.	【集約エクスプリシットディメンション】	集約のエクスプリシットディメンションの記述の指定場所。
srcd-25	422	8	srcd	senarioExplicitDimension	senarioExplicitDimensionItemType	Senario Explicit Dimension	The QName value must be resolved to a valid dimension item.	集約ディメンション	QNameの値は妥当なディメンション項目を示さなければならない。
srcd-26	423	8	srcd	senarioExplicitDimensionValue	senarioExplicitDimensionValueItemType	Senario Explicit Dimension Value	The QName value must be resolved to valid member item.	集約エクスプリシットディメンション値	QNameの値は妥当なメンバ項目を示さなければならない。
srcdG-12	424	7	srcd	senarioTyped	_	Senario Typed	This structure allows to explicitly indicate the information related to a typed dimension in the context for a fact in the FR instance.	【集約タイプトディメンション】	集約のタイプトディメンションの記述の指定場所。
srcd-27	425	8	srcd	senarioTypedDimension	senarioTypedDimensionItemType	Senario Typed Dimension	The QName value must be resolved to a valid dimension item.	集約ディメンション	QNameの値は妥当なディメンション項目を示さなければならない。
srcd-28	426	8	srcd	senarioTypedDimensionValue	senarioTypedDimensionValueItemType	Senario Typed Dimension Value	The value must be CDATA and a valid XML fragment and also schema valid against an appropriate typed dimension schema.	集約タイプトディメンション値	CDATAであり、妥当なXML記述でなければならない。スキーマは、入力されたディメンションスキーマに対して妥当でなければならない。
srcdG-13	427	7	srcd	senarioSimpleElement	_	Senario Simple Element	This structure allows to explicitly indicate the information related to a simple elemtn in the context for a fact in the FR instance.	【集約シンプルエレメントコンテント】	セグメントまたはシナリオの、空要素を表現するためのタプル。
srcd-29	428	8	srcd	senarioSimpleElementContent	senarioSimpleElementContentItemType	Senario Simple Element Content	QName for the simple element, if appropriate.	集約シンプルエレメント名	集約シンプルエレメントの記述のQName
srcd-30	429	8	srcd	senarioSimpleElementValue	senarioSimpleElementValueItemType	Senario Simple Element Value	The value of the simple element.	集約シンプルエレメント値	シンプルエレメントの値。
srcd-31	430	7	srcd	senarioNonDimensionalContents	senarioNonDimensionalContentsItemType	Senario Non Dimensional Contents	The value must be CDATA and a valid XML fragment.	集約非ディメンションコンテント	CDATAであり、妥当なXML記述でなければならない。
srcdG-14	431	5	srcd	summaryUnit	_	Summary Unit	This structure allows to explicitly indicate the information related to the unit for a fact in the FR instance..	【集約ユニット】	集約のユニットの記述の指定場所。
srcd-32	432	6	srcd	summaryNumerator	summaryNumeratorItemType	Summary Unit Numerator	This holds the list of measure information for unit numerator. The value must be a list of QName. Each QName must be resolved to be measure information such as iso4217:usd.	集約ユニット分子	集約のユニットの分子の測定情報のリスト。QNameのリストでなければならない。QNameはiso4217:usdのような、解決される測定情報でなければならない。
srcd-33	433	6	srcd	summaryDenominator	summaryDenominatorItemType	Summary Unit Denominator	This holds the list of measure information for unit denominator. The value must be a list of QName. Each QName must be resolved to be measure information such as iso4217:usd.	集約ユニット分母	集約のユニットの分母の測定情報のリスト。QNameのリストでなければならない。QNameはiso4217:usdのような、解決される測定情報でなければならない。
