bus-54	3	bus	organizationAccountingMethodEndDate	organizationAccountingMethodEndDateItemType	Accounting Method End Date	Accounting Method End Date	会計処理方法終了日付	会計処理方法の終了日。
busG-12	2	bus	accountantInformation	_	Accountant Information	Information about the relevant external accountant	【会計士情報】	関連する外部会計士に関する情報。
bus-55	3	bus	accountantName	accountantNameItemType	Accountant Name	Name of the accountant	会計士名	会計士の名前。
busG-13	3	bus	accountantAddress	_	Accountant Address	Section which contains accountant address information.	【会計士住所】	会計士の住所情報を含むセクション。
bus-56	4	bus	accountantAddressName	accountantAddressNameItemType	Address Name	Address Name for Accountant	会計士住所名	会計士の住所の名前。
bus-57	4	bus	accountantAddressDescription	accountantAddressDescriptionItemType	Address Description	Address Description for Accountant	会計士住所説明	会計士の住所の説明。
bus-58	4	bus	accountantAddressPurpose	accountantAddressPurposeItemType	Address Purpose	Address Purpose	会計士住所目的	住所の目的。
bus-59	4	bus	accountantAddressLocationIdentifier	locationIdentifierItemType	Accountant Location Identifier	A code used to identify the accountant location and to associate it with contacts and transactions	会計士所在地識別子	会計士の所在地を識別したり、窓口や取引と関係付けるコード。
bus-60	4	bus	accountantBuildingNumber	accountantBuildingNumberItemType	Building Number	Building Number for Accountant	会計士住所建物番号	会計士の建物番号。
bus-61	4	bus	accountantStreet	accountantStreetItemType	Street	Street address of the accountant	会計士住所通り	会計士の住所の通り。
bus-62	4	bus	accountantAddressStreet2	accountantAddressStreet2ItemType	Address Detail	Address Detail for Accountant	会計士住所詳細	会計士の住所詳細。
bus-63	4	bus	accountantCity	accountantCityItemType	City	City of the accountant	会計士住所都市	会計士の住所の都市。
bus-64	4	bus	accountantStateOrProvince	accountantStateOrProvinceItemType	State or Province	State, province or region of the accountant	会計士住所州	会計士の住所の州や地方。
bus-65	4	bus	accountantCountry	accountantCountryItemType	Country	Country of accountant	会計士住所国	会計士の住所の国。
bus-66	4	bus	accountantZipOrPostalCode	accountantZipOrPostalCodeItemType	Zip or Postal Code	Zip or other postal code of the accountant	会計士住所郵便番号	会計士の住所の郵便番号。
bus-67	4	bus	accountantAddressActive	gl-gen:activeItemType	Accountant Address Active	Boolean to indicate whether the address is active (="true") or inactive (="false")	会計士住所有効性	会計士の住所が有効か無効かを示すブール値。
bus-68	3	bus	accountantEngagementType	accountantEngagementTypeItemType	Type of Engagement	Type of engagement being performed by external accountant	契約種別	外部会計士によって実行される契約の種別。\n[設定値のリスト]\n(audit：監査)、(review：検査)、(compilation：調整)、(tax：税)、(other：その他) 
bus-69	3	bus	accountantEngagementTypeDescription	accountantEngagementTypeDescriptionItemType	Type of Engagement Description	Free format description of the type of engagement	契約種別説明	契約種別の説明。
busG-14	3	bus	accountantContactInformation	_	Accountant Contact Information	Accountant Contact Information Structure	【会計士担当者情報】	会計士の担当者情報の構造体。
bus-70	4	bus	accountantContactPrefix	accountantContactPrefixItemType	Prefix	Prefix (e.g. Dr., Mr., Mrs., etc.) for Accountant Contact	会計士担当者敬称	会計士の担当者の敬称(Dr.、Mr.、Mrs.など)\n
bus-71	4	bus	accountantContactLastName	accountantContactLastNameItemType	Last Name	Family Name for Accountant Contact	会計士担当者姓	会計士の担当者の姓\n
bus-72	4	bus	accountantContactFirstName	accountantContactFirstNameItemType	First  Name	First or Given Name for Accountant Contact	会計士担当者名	会計士の担当者の名、クリスチャンネーム\n
bus-73	4	bus	accountantContactSuffix	accountantContactSuffixItemType	Suffix	Suffix (e.g. MD, CPA, Jr., etc.)	会計士担当者付加名称	付加名称(MD、CPA、Jr.など)\n
bus-74	4	bus	accountantContactAttentionLine	accountantContactAttentionLineType	Attention Line	Attention Line for Accountant Contact	会計士担当者アテンションライン	会計士の担当者のアテンションライン\n
bus-75	4	bus	accountantContactPositionRole	accountantContactPositionRoleItemType	Position/Role	Position or Role for Accountant Contact	会計士担当者地位/役職	会計士の担当者の地位や役職\n
busG-15	4	bus	accountantContactPhone	_	Contact Phone	Phone Number for Accountant Contact	【会計士担当者電話番号】	会計士の担当者の電話番号\n
bus-76	5	bus	accountantContactPhoneNumberDescription	gl-gen:phoneNumberDescriptionItemType	Accountant Contact Phone Number Description	Accountant Contact Phone Number Description such as Main, Investor relations, etc.	会計士担当者電話番号説明	代表、IR用などの、会計士の担当者の電話番号の説明。\n[設定値のリスト]\n(bookkeeper：記帳係)、(controller：会計責任者)、(direct：直通)、(fax：FAX)、(investor-relations：IR担当者)、(main：代表)、(switchboard：交換台)、(other：その他) 
bus-77	5	bus	accountantContactPhoneNumber	gl-gen:phoneNumberItemType	Accountant Contact Phone Number	Accountant Contact phone number referred to in the description.	会計士担当者電話番号	説明で示される会計士の担当者の電話番号。\n
busG-16	4	bus	accountantContactFax	_	Contact Fax Number Structure	Accountant Contact Fax Number Structure	【会計士担当者FAX番号】	会計士の担当者のFAX番号の構造体。
bus-78	5	bus	accountantContactFaxNumber	gl-gen:faxNumberItemType	Accountant Contact Fax Number	Accountant Contact Fax Number	会計士担当者FAX番号	会計士の担当者のFAX番号。
bus-79	5	bus	accountantContactFaxNumberUsage	gl-gen:faxNumberUsageItemType	Accountant Contact Fax Number Usage	Accountant Contact Fax Number Usage (e.g. orders, head office, IR)	会計士担当者FAX番号用途	会計士の担当者のFAX番号の用途。(注文、本社、IRなど)\n
busG-17	4	bus	accountantContactEmail	_	Contact Email Address Structure	Accountant contact E-mail address structure	【会計士担当者Eメールアドレス】	会計士の担当者のEメールアドレスの構造体。
bus-80	5	bus	accountantContactEmailAddressUsage	gl-gen:emailAddressUsageItemType	Accountant Contact Email Address Usage	Accountant Contact email address usage (e.g. orders, head office, IR)	会計士担当者Eメールアドレス用途	会計士の担当者のEメールアドレスの用途。(注文、本社、IRなど)\n
bus-81	5	bus	accountantContactEmailAddress	gl-gen:emailAddressItemType	Accountant Contact Email Address	Accountant Contact email address	会計士担当者Eメールアドレス	会計士の担当者のEメールアドレス。
bus-82	4	bus	accountantContactType	accountantContactTypeItemType	Accountant Contact Type	Contact Type for Accountant Contact	会計士担当者役割	会計士の担当者の種別\n
bus-83	4	bus	accountantLocationIdentifierCrossReference	locationIdentifierItemType	Accountant Location ID cross reference	This code is used to associate the contact with a specific location for the Accountant. Its value should be the same as that of the accountantAddressLocationIdentifier	会計士所在地相互参照情報	担当者と会計士の所在地情報を関係付けるためのコード。\naccountantAddressLocationIdentifierと同じ値であるべき。
bus-84	4	bus	accountantContactActive	gl-gen:activeItemType	Accountant Contact Active	Boolean to indicate whether the contact is active (="true") or inactive (="false")	会計士担当者有効性	担当者が有効か無効かを示すブール値。
busG-18	2	bus	reportingCalendar	_	Reporting Calendar	A tool to collect the periods used to summarise results from transactions.	【報告カレンダー】	取引の結果をまとめるための期間を集めるもの。
bus-85	3	bus	reportingCalendarCode	reportingCalendarCodeItemType	Reporting Calendar Code	The code used to identify this specific reporting calendar, unique across periods	報告カレンダーコード	この報告カレンダーを識別するコード。複数期間にわたって一意。
bus-86	3	bus	reportingCalendarDescription	reportingCalendarDescriptionItemType	Reporting Calendar Description	A description of the reporting calendar (associated with the reportingCalendarCode given)	報告カレンダー説明	報告カレンダーの説明（reportingCalendarCodeと関係付けられる）。
bus-87	3	bus	reportingCalendarTitle	reportingCalendarTitleItemType	Reporting Calendar Title	A description of the reporting period. The actual beginning and ending dates are found within the 'reportingCalendarPeriod' structure	報告カレンダータイトル	報告期間の説明。実際の開始日及び終了日はreportingCalendarPeriodに記述する。
bus-88	3	bus	reportingCalendarPeriodType	reportingCalendarPeriodTypeItemType	Code Related to Type of Periods	A code for the type of period involved. Enumerated as: monthly, quarterly, semi-annually, 4-5-4, ad-hoc, other.	期間種別コード	報告期間の種別コード。月次、四半期ごと、半期ごと、4-5-4、随時、その他\n[設定値のリスト]\n(monthly：月次)、(quarterly：四半期ごと)、(semi-annually：半期ごと)、(4-5-4：4-5-4)、(ad-hoc：随時)、(other：その他) \n
bus-89	3	bus	reportingCalendarPeriodTypeDescription	reportingCalendarPeriodTypeDescriptionItemType	Description of periods	A description of the type of period involved.	期間種別説明	報告期間の種別の説明。
bus-90	3	bus	reportingCalendarOpenClosedStatus	reportingCalendarOpenClosedStatusItemType	Closed status	An identifier on whether the reporting calendar is still open for activity. enumerated, "open", "closed", "pending"	締状態	報告カレンダーがオープンかどうかを示す識別子。オープン、締切り済み、保留中\n[設定値のリスト]\n(open：オープン)、(closed：締切り済み)、(pending：保留中) \n
bus-91	3	bus	reportingPurpose	accountingMethodPurposeItemType	Reporting Purpose	A description of the accounting set of books involved. Uses enumeration from accounting method purpose.	報告目的	帳簿の集合の説明。会計処理方法の目的の列挙値を使用する。\n[設定値のリスト]\n(book：帳簿)、(tax：税)、(management：管理)、(statutory：スタチュトリ)、(other：その他)
bus-92	3	bus	reportingPurposeDescription	reportingPurposeDescriptionItemType	Reporting Purpose Description	Free format description of the reporting purpose	報告目的説明	報告目的の説明。
cenG-14	3	cen	INVOICING_PERIOD	xbrli:stringItemtype	INVOICING PERIOD	_	_	_
cen-166	4	cen	periodStartDate	dateItemtype	Period Start Date	_	_	_
cen-167	4	cen	periodEndDate	dateItemtype	Period End Date	_	_	_
busG-19	3	bus	reportingCalendarPeriod	_	Reporting Calendar Period	A tool to collect a specific set of periods used to summarize results from transactions.	【報告カレンダー期間】	取引の結果をまとめるための特定の期間を集めるもの。
bus-93	4	bus	periodIdentifier	periodIdentifierItemType	Reporting Period Identifier	An identifier for this period in this calendar	報告期間識別子	このカレンダーにおけるこの期間の識別子。
bus-94	4	bus	periodDescription	periodDescriptionItemType	Period Description	A description of this specific reporting period in this calendar.	期間説明	このカレンダーにおけるこの特定の期間の説明。
bus-95	4	bus	periodStart	periodStartItemType	Period Start Date	The beginning date/time of a period	期間開始日付	期間の開始日付/時刻\n
bus-96	4	bus	periodEnd	periodEndItemType	Period End Date	The ending date/time of a period	期間終了日付	期間の終了日付/時刻\n
bus-97	4	bus	periodClosedDate	periodClosedDateItemType	Period Closed Date	The date/time a period has been closed for activity. If this is present with a nill value (xsi:nill="true") then the period is not closed.	期間締日付	この期間の活動が締め切られた日付/時刻。この値がニル値(xsi:nill="true")であれば、この期間は、締め切られていない。
corG-4	1	cor	entryHeader	_	Entry Information	Parent for entry headers/journal entry headers.	【仕訳情報】	エントリヘッダー/仕訳記入ヘッダーの親タグ。
cor-10	2	cor	postedDate	postedDateItemType	Date Posted	Date this entry was posted (validated) to the general ledger. May not represent the date of accounting significance which is represented by 'postingDate'.	転記済日付	この仕訳が総勘定元帳に転記された(検証された)日付。 postingDateで示されるような会計上意味のある日付を表さないかもしれない。
cor-11	2	cor	enteredBy	enteredByItemType	Entry Creator	Initials/name of operator originally entering.	仕訳作成者	最初に入力したオペレータのイニシャル/名前。
bus-98	2	bus	enteredByModified	enteredByModifiedItemType	Entry Last Modifier	Identification for the last person modifying this entry before posting.	仕訳最終更新者	転記前に最後にこの仕訳を修正した者の識別子。
cor-12	2	cor	enteredDate	enteredDateItemType	Entry Date	Represents the actual date/time of entry into computer (automated from system date, often misrepresented by changing system clock). Posting dates are maintained separately.	入力日付	コンピュータへ入力した実際の日付/時刻(システム日付から自動的に与えられ、システム時計の変更により、しばしば誤った値になる)を示す。 転記日付とは別に管理される。
bus-99	2	bus	entryResponsiblePerson	entryResponsiblePersonItemType	Responsible Person	Identifier of person who created or originated or is otherwise responsible for the entry.	責任者	仕訳を作成したか、仕訳に責任を持つ者の識別子。
cor-13	2	cor	sourceJournalID	gl-gen:sourceJournalIDItemType	Source Journal	Source journal. The code of the journal in which the entry is processed. The code must be a unique indication for a journal and is selected from the following enumerated list:\ncd      cash disbursements (sending cheques to vendors)\ncr      cash receipts (receiving cheques from others)\nfa      fixed assets\ngi      giro/other bank adjustments\ngj      general journal\nim      inventory management\njc      job cost\npj      purchase journal (liabilities from purchases)\npl      payroll journal\nsj      sales journal\nse      standard entries\nud      user defined\not      other sources of entries"	元仕訳帳種別	元仕訳帳。仕訳が処理される仕訳帳のコード。コードは仕訳帳に一意な指標であり、以下から選択する。\n出金(仕入先への小切手送付)、入金(他者からの小切手受領)、固定資産、振替、一般仕訳帳、在庫管理、個別原価、仕入帳(仕入による負債)、賃金台帳、売上台帳、通常仕訳、ユーザ定義、その他\n[設定値のリスト]\n(cd：出金)、(cr：入金)、(fa：固定資産)、(gi：振替)、(gj：一般仕訳帳)、(im：在庫管理)、(jc：個別原価)、(pj：仕入帳)、(pl：賃金台帳)、(sj：売上台帳)、(se：通常仕訳)、(ud：ユーザ定義)、(ot：その他)
bus-100	2	bus	sourceJournalDescription	sourceJournalDescriptionItemType	Journal Description	Source journal (full description of general journal, payroll journal, accountant entries). A more easily readable journal indication. The most common journals are: Purchases, Sales, Cash, and General Journal.	元仕訳帳説明	元仕訳帳(一般仕訳、給与台帳、会計士入力の完全な説明)。 よりわかりやすい仕訳帳の指標。 最も一般的な仕訳帳は、次の通り。 仕入、売上、現金、一般仕訳。
cor-14	2	cor	entryType	gl-gen:entryTypeItemType	Type Identifier	One of the following enumerated list: adjusting, budget, comparative, external-accountant, standard, passed-adjusting, eliminating, proposed, recurring, reclassifying, simulated, tax, other	種別識別子	以下の値のうちのひとつ。\n整理、予算、比較、外部会計士、通常、無視、消去、提案、反復、組替、シミュレーション、税、その他\n[設定値のリスト]\n(adjusting：整理)、(budget：予算)、(comparative：比較)、(external-accountant：外部会計士)、(standard：通常)、(passed-adjusting：無視)、(eliminating：消去)、(proposed：提案)、(recurring：反復)、(reclassifying：組替)、(simulated：シミュレーション)、(tax：税)、(other：その他)
bus-101	2	bus	entryOrigin	entryOriginItemType	Entry Origin	Origin of entry: accrual, manual entry, imported entry, exchange gain or loss	仕訳起源	仕訳の起源。発生、手入力、インポート入力、為替換算による損益。
cor-15	2	cor	entryNumber	entryNumberItemType	Entry Identifier	Identifier within source journal	仕訳識別子	元仕訳帳中の識別子。
cor-16	2	cor	entryComment	entryCommentItemType	Entry Description	Description of entry described by this entry header (e.g. Opening Balance)	仕訳説明	このエントリヘッダーによって説明された仕訳の説明(例えば、期首残高)\n
cor-17	2	cor	qualifierEntry	gl-gen:qualifierEntryItemType	Entry Qualifier	Entry Qualifier - An enumerated field that qualifies the type of entry, specifically useful for general ledger and trial balance environments when it is important to state the values represented are summarized as of the reporting date - opening or closing balances. In accounting systems, this is often known as BBF (balance brought forward.) Permitted values are: standard, balance-brought-forward and other.	仕訳修飾子	仕訳の修飾子。総勘定元帳や試算表で、開始残高や決算残高のように、記された値が報告日で集約されていることを明示することが重要なときに有用な、仕訳の種別を修飾するもの。会計システムにおいて、BBF（繰越残高）として知られるもの。指定可能な値は以下。標準、繰越残高、その他\n[設定値のリスト]\n(standard：標準)、(balance-brought-forward：繰越残高)、(other：その他) 
cor-18	2	cor	qualifierEntryDescription	qualifierEntryDescriptionItemType	Entry Qualifier Description	Free format description of the entry qualifier	仕訳修飾子説明	仕訳の修飾子の説明。
bus-102	2	bus	postingCode	postingCodeItemType	Posting Code	Code for posting to period, e.g., period 1-13, based on codes in an accounting period file. We do not recommend that software vendors export here, but suggest providing period end numbers for the buckets. Possibilities W1 through W53, M1 through M13, Q1-Q4. Developers and others creating output files are encouraged to supply an actual end date.	転記コード	転記の期間を表すコード。例えば、会計期間ファイルのコードにもとづく期間１～１３。ソフトウエアベンダーが、この値をエクスポートすることは推奨しない。期間の最終番号を提供することを勧める。可能な値としては、W1からW53、M1からM13、Q1からQ4など。開発者や出力ファイルの作成者には、実際の終了日付を提供することを勧める。
bus-103	2	bus	batchID	batchIDItemType	Batch ID for Entry Group	ID for a batch for this group of entries	仕訳グループ識別子	この仕訳の集合に付ける、束の識別子。
bus-104	2	bus	batchDescription	batchDescriptionItemType	Batch Description	Description of this batch	仕訳グループ説明	この仕訳の束の説明。
bus-105	2	bus	numberOfEntries	numberOfEntriesItemType	Number of Entries	The total number of entries.	仕訳総数	仕訳の総数。
bus-106	2	bus	totalDebit	totalDebitItemType	Total Debits	The total of all debit amounts.	借方合計	借方金額の合計値。
bus-107	2	bus	totalCredit	totalCreditItemType	Total Credits	The total of all credit amounts.	貸方合計	貸方金額の合計値。
cor-19	2	cor	bookTaxDifference	gl-gen:bookTaxDifferenceItemType	Type of Difference Between Book and Tax	Enumerated field with possible values of permanent, temporary or none indicating the type of difference between book and tax accounting methods. Omission of this field is equivalent to "none"	帳簿価税務簿価差異種別	帳簿と税務会計処理方法との差異の種別を示す値。永久か一時的かまたは無し。値の省略時は「無し」と同じ。\n[設定値のリスト]\n(permanent：永久)、(temporary：一時的)、(none：無し)
bus-108	2	bus	eliminationCode	eliminationCodeItemType	Elimination Code	Informs destination ledger this is an intracompany entry which eliminates in consolidation	相殺消去コード	連結決算時に消去される連結会社間仕訳であることを、受取側の元帳に通知する。
bus-109	2	bus	budgetScenarioPeriodStart	budgetScenarioPeriodStartItemType	Budget Scenario Period Start	Start of period covered by associated budgetScenario	予算シナリオ期間開始日付	関係付けられたbudgetScenarioがカバーする期間の開始日。
bus-110	2	bus	budgetScenarioPeriodEnd	budgetScenarioPeriodEndItemType	Budget Scenario Period End	End of period covered by associated budgetScenario	予算シナリオ期間終了日付	関係付けられたbudgetScenarioがカバーする期間の終了日。
bus-111	2	bus	budgetScenarioText	budgetScenarioTextItemType	Scenario Description	Text related to budgetScenario	シナリオ説明	budgetScenarioに関する記述。
bus-112	2	bus	budgetScenario	budgetScenarioItemType	Scenario Code	Code for a budget scenario identifier (such as PB for 'preliminary budget', or RB for 'revised budget', or other identifier for entryType)	シナリオコード	予算シナリオの識別コード。例えば、「PB」（予備予算）、「RB」（補正予算）、または他の仕訳種別の識別子。
bus-113	2	bus	budgetAllocationCode	budgetAllocationCodeItemType	Budget Allocation Code	Code associated with the calculation formula: e.g. (D)ivide by number of periods, (T)otal for period given	予算配分コード	計算式に関係付けられたコード。例えば、期間数での分割、与えられた期間の合計\n[設定値のリスト]\n(D：期間数での分割)、(T：与えられた期間の合計) 
usk-1	2	usk	reversingStdId	reversingStdIdItemType	ID for Reversing, Standard or Master Entry	For standard, reversing, master, cancelling or other entries an ID associated with those entries.	反対/通常/マスタ仕訳識別子	通常、反対、マスタ、取消または他の仕訳のための、それらの仕訳を関連付けるID。
usk-2	2	usk	recurringStdDescription	recurringStdDescriptionItemType	Recurring Standard Description	Description to accompany standard or recurring ID	反復通常仕訳説明	通常仕訳または反復仕訳のIDの説明。
usk-3	2	usk	frequencyInterval	frequencyIntervalItemType	Frequency Interval	For standard or recurring journals, how often entry may be made: every frequencyInterval frequencyUnit, such as every 7 (interval) days (unit) or every 1 (interval) quarter (unit). This field represents the interval.\n	頻度間隔	通常または反復仕訳において、仕訳が記入される頻度。frequencyInterval、frequencyUnitごと、たとえば7(interval)日(unit)ごと、1(interval)四半期(unit)ごとなどにおける、intervalを示す。
usk-4	2	usk	frequencyUnit	frequencyUnitItemType	Frequency Unit	For standard or recurring journals, how often entry may be made: every frequencyInterval frequencyUnit, such as every 7 (interval) days (unit) or every 1 (interval) quarter (unit). This field represents the unit.\n	頻度単位	通常または反復仕訳において、仕訳が記入される頻度。frequencyInterval、frequencyUnitごと、たとえば7(interval)日(unit)ごと、1(interval)四半期(unit)ごとなどにおける、unitを示す。
usk-5	2	usk	repetitionsRemaining	repetitionsRemainingItemType	Repetitions Remaining	Number of times that the recurring entry will repeat	反復残回数	反復仕訳の繰り返し予定数。
usk-6	2	usk	nextDateRepeat	nextDateRepeatItemType	Next Date Repeat	Date next repeated or standard posted	次回反復日付	次回の反復あるいは通常の転記日。
usk-7	2	usk	lastDateRepeat	lastDateRepeatItemType	Last Date Repeat	Date last repeated or standard posted	前回反復日付	前回の反復あるいは通常の転記日。
usk-8	2	usk	endDateRepeatingEntry	endDateRepeatingEntryItemType	End Date of Repeating Entry	For standard or recurring journals, stop date/time for repetitive entry.	反復仕訳終了日付	通常仕訳または反復仕訳のための、反復入力の終了日付/時刻。
usk-9	2	usk	reverse	reverseTypeItemType	Reverse	Should entry be reversed?	反対仕訳要否	仕訳が取り消されるべきか。
usk-10	2	usk	reversingDate	reversingDateItemType	Reversing Date	Date this entry should be reversed	反対仕訳日付	この仕訳が取り消されるべき日付。
