code	0	level	module	term	type	label	description	label-ja
cen-124	283	4	cen	ExternalDocumentLocation	textItemType	External document location	The URL (Uniform Resource Locator) that identifies where the external document is located.	_
cen-125	284	4	cen	AttachedDocument	binaryobjectItemType	Attached document	An attached document embedded as binary object or sent together with the invoice.	_
cen-125a	285	4	cen	AttachedDocumentMimeCode	textItemType	Attached document Mime code	The mime code of the attached document.	_
cen-125b	286	4	cen	AttachedDocumentFilename	textItemType	Attached document Filename	The file name of the attached document	_
cen-8	287	3	cen	ValueAddedTaxPointDateCode	codeItemType	Value added tax point date code	The code of the date when the VAT becomes accountable for the Seller and for the Buyer.	_
cen-18	288	3	cen	InvoicedObjectIdentifier	identifierItemType	Invoiced object identifier	An identifier for an object on which the invoice is based, given by the Seller.	_
corG-5	289	3	cor	entryDetail	_	Entry Detail	Parent for entry detail	【仕訳明細】
cor-21	290	4	cor	lineNumber	lineNumberItemType	Line Number	Identifier for a particular entry detail\n	明細行番号
cor-22	291	4	cor	lineNumberCounter	counterItemType	Line Number Counter	Unique reference for the line - a numeric counter	明細行番号カウンタ
cen-131	292	4	cen	InvoiceLineNetAmount	amountItemType	Invoice line net amount	The total amount of the Invoice line.	
cenG-26	293	4	cen	INVOICE_LINE_PERIOD	_	INVOICE LINE PERIOD	A group of business terms providing information about the period relevant for the Invoice line.	_
cen-134	294	5	cen	linePeriodStartDate	dateItemType	Invoice line period start date	The date when the Invoice period for this Invoice line starts.	_
cen-135	295	5	cen	linePeriodEndDate	dateItemType	Invoice line period end date	The date when the Invoice period for this Invoice line ends.	_
corG-6	296	4	cor	account	_	Account Identifier	Tuple: parent container for account numbers and identifiers. No entry is made here, but each detail line may have multiple accounts assigned to it for reporting in different GAAPs, offsetting accounts in Japan, passing along information to consolidation systems about local versus consolidating accounts, etc. For example, the account 4783HG-QOWI-192837-1000 may be expressed so: \n/account/accountMainID 1000  \n/account/accountMainDescription Cash  \n/account/accountSub/accountSubID 4783HG  \n/account/accountSub/accountSubDescription Department  \n/account/accountSub/accountSubID QOWI  \n/account/accountSub/accountSubDescription Branch  \n/account/accountSub/accountSubID 192837  \n/account/accountSub/accountSubDescription Division	【科目識別子】
cor-23	297	5	cor	accountMainID	accountMainIDItemType	Main Account Number	Main account - the code used to identify the accounting bucket the entry has been assigned to. Examples might be 1000 for Cash, 567GAAZ for Sales Expense or Z for tax payments. Identifiers such as department, branch, division, manager, or other modifiers are noted in the Subaccount area. Before needing to post, account is not necessary. Posting to the general ledger almost always requires an entry here.	主勘定科目コード
cor-24	298	5	cor	accountMainDescription	accountMainDescriptionItemType	Main Account Description	Description of accountMainID - the human readable describer that accompanies the code used in accountMainID	主勘定科目説明
cor-25	299	5	cor	mainAccountType	gl-gen:mainAccountTypeItemType	Account Classification	Account type - FASB Concepts 6 and similar international designs. When xbrlInfo is used to associate other XBRL reporting items, this field is more suited to representing existing systems (audit) than data interchange.	主勘定科目区分
cor-26	300	5	cor	mainAccountTypeDescription	mainAccountTypeDescriptionItemType	Account Classification Description	Free format description of the account classification	主勘定科目区分説明
cor-27	301	5	cor	parentAccountMainID	parentAccountMainIDItemType	Parent Account Number	Roll up item from child natural account to parent natural account.	親勘定科目コード
cor-28	302	5	cor	accountPurposeCode	gl-gen:accountPurposeCodeItemType	Purpose of Account	Code related to usage for account aggregate - Consolidating, European, IFRS, Offsetting, Primary, Tax, USGAAP, Japanese, Other. Japanese companies will use this for the tax required offsetting entry. If left blank, assumes default accounting method for company.	勘定科目目的
cor-29	303	5	cor	accountPurposeDescription	accountPurposeDescriptionItemType	Description of Purpose of Account	Description of usage for aggregate account	勘定科目目的説明
cor-30	304	5	cor	accountType	gl-gen:accountTypeItemType	Account Type	Type of account	科目種別
cor-31	305	5	cor	accountTypeDescription	accountTypeDescriptionItemType	Account Type Description	Free format description of the account type	科目種別説明
bus-114	306	5	bus	entryAccountingMethod	accountingMethodItemType	Entry Accounting Method	For this entry, the method of accounting represented - from: accrual, cash, modified cash, modified accrual, encumbrance, special methods, hybrid methods, other	仕訳会計処理方法
bus-115	307	5	bus	entryAccountingMethodDescription	entryAccountingMethodDescriptionItemType	Entry Accounting Method Description	Free format description of the entry accounting method	仕訳会計処理方法説明
bus-116	308	5	bus	entryAccountingMethodPurpose	accountingMethodPurposeItemType	Entry Accounting Method Purpose	For this entry, the reporting purpose represented - from book, tax, management, statutory, other	仕訳会計処理方法目的
bus-117	309	5	bus	entryAccountingMethodPurposeDescription	entryAccountingMethodPurposeDescriptionItemType	Entry Accounting Method Purpose Description	Free format description of the entry accounting method purpose	仕訳会計処理方法目的説明
corG-7	310	5	cor	accountSub	_	Subaccount Information	Tuple to hold multiple accountSubIDs and Descriptions	【サブ科目情報】
cor-32	311	6	cor	accountSubDescription	accountSubDescriptionItemType	Subaccount Description	The description that accompanies accountSubID belongs here.	サブ科目説明
cor-33	312	6	cor	accountSubID	accountSubIDItemType	Subaccount	Where the primary account was placed in accountMainID, the code used for each profit center, division, business unit, fund, program, branch, project, class, su-class or other modifier is placed here.	サブ科目コード
cor-34	313	6	cor	accountSubType	accountSubTypeItemType	Type of Subaccount	Type of sub-account - profit center, division, business unit, fund, program, branch, project, class, su-class or other modifier is placed here. For example:: Accountability center: Business unit: Class:Department: Project: Fund: Program:Job: Profit center: Branch: Setup class: Division: Unit	サブ科目種別
corG-8	314	6	cor	segmentParentTuple	_	Segment Parent Information	Tuple for showing the detail necessary to roll up from one segment (type of subaccount) to another.)	【親セグメント情報】
cor-35	315	7	cor	parentSubaccountCode	parentSubaccountCodeItemType	Parent Subaccount Code	Subaccount NUMBER this subaccount rolls up to - see also subaccount type it rolls up to.	親サブ科目コード
cor-36	316	7	cor	parentSubaccountType	parentSubaccountTypeItemType	Parent Subaccount Type	The describer of the segment this subaccount rolls up to.	親サブ科目種別
cor-37	317	7	cor	reportingTreeIdentifier	reportingTreeIdentifierItemType	Reporting Tree Identifier	Used for representing descriptions of reporting trees.	報告系統識別子
cor-38	318	7	cor	parentSubaccountProportion	parentSubaccountProportionItemType	Parent Subaccount Percentage	For partial allocations of amounts to different parents, the percentage of a child that will be allocated to a parent.	親サブ科目配分パーセンテージ
cor-39	319	5	cor	accountActive	gl-gen:activeItemType	Account Active	Boolean to indicate whether the account is active (="true") or inactive (="false")	科目有効性
cor-40	320	4	cor	amount	gl-gen:amountItemType	Monetary Amount	This field (amount) represents the primary monetary amount related to the  subject of the entryDetail line. There is one primary monetary amount per entryDetail structure. It may, for example, represent the amount of one line of a journal entry, the balance on a document, or the extended amount of a line item on an invoice. Amount is not required if detailed entry is used for non-financial work and other elements are populated, in particular measurableQuantity. The amount field is a signed number (either positive or negative itself) and used in conjunction with a separate signOfAmount and a separate debitCreditCode, which together are considered for understanding the monetary amount. The unit of measure is determined by amountCurrency if present, and by the default or home currency if amountCurrency is not present.	金額
muc-2	321	4	muc	amountCurrency	currencyItemType	Currency	The currency related to the amount can be entered here instead of the XBRL instance specified way, especially important in multi-currency situations. Recommend ISO 4217 coding.	通貨
muc-6	322	4	muc	amountOriginalExchangeRateDate	exchangeRateDateItemType	Original Exchange Rate Date	Date of exchange rate used to record the original transaction.	原取引通貨換算レート日付
muc-3	323	4	muc	amountOriginalAmount	gl-gen:amountItemType	Amount in Original Currency	Amount in original (as opposed to home) currency, for multi-currency tracking.	原取引通貨換算額
muc-4	324	4	muc	amountOriginalCurrency	currencyItemType	Original Currency	The currency used to track original, as opposed to home, amounts. Recommended ISO 4217 coding.	原取引通貨
muc-5	325	4	muc	amountOriginalExchangeRate	exchangeRateItemType	Original Exchange Rate	Exchange rate at time of original transaction (expressed as national currency divided by original currency)	原取引通貨換算レート
muc-7	326	4	muc	amountOriginalExchangeRateSource	exchangeRateSourceItemType	Original Exchange Rate Source	Source of Exchange Rate - for example, Reuters, Bloomberg	原取引通貨換算レート情報源
muc-8	327	4	muc	amountOriginalExchangeRateComment	commentItemType	Original Exchange Rate Comment	Comment about exchange rate used for recording original transaction.	原取引通貨換算レートコメント
muc-9	328	4	muc	amountOriginalTriangulationAmount	gl-gen:amountItemType	Original Amount in Triangulation Currency	If triangulation is used, amount in triangulation currency, for multi-currency tracking. Debit is entered as positive, credit as negative.	原取引トライアンギュレーション通貨換算額
muc-10	329	4	muc	amountOriginalTriangulationCurrency	currencyItemType	Original Triangulation Currency	The currency used for triangulation, if used. May often be EUR or USD. Recommended ISO 4217 coding.	原取引トライアンギュレーション通貨
muc-11	330	4	muc	amountOriginalTriangulationExchangeRate	exchangeRateItemType	National to Triangulation Currency Exchange Rate	Exchange rate between national currency and triangulation currency at time of original transaction (expressed as national currency divided by triangulation currency)	自国通貨トライアンギュレーション通貨換算レート
muc-12	331	4	muc	amountOriginalTriangulationExchangeRateSource	exchangeRateSourceItemType	National to Triangulation Currency Exchange Rate Source	Source of Exchange Rate for triangulation amount at time of original transaction - for example, Reuters, Bloomberg	自国通貨トライアンギュレーション通貨換算レート情報源
muc-13	332	4	muc	amountOriginalTriangulationExchangeRateType	exchangeRateTypeItemType	National to Triangulation Currency Exchange Rate Type	Type of Exchange Rate for triangulation amount at time of original transaction - for example, spot rate, forward contract etc.	自国通貨トライアンギュレーション通貨換算レート種別
muc-14	333	4	muc	originalTriangulationExchangeRate	exchangeRateItemType	Original to Triangulation Currency Exchange Rate	Exchange rate between original currency and triangulation currency at time of original transaction (expressed as original currency divided by triangulation currency)	原取引通貨トライアンギュレーション通貨換算レート
muc-15	334	4	muc	originalExchangeRateTriangulationSource	exchangeRateSourceItemType	Original to Triangulation Currency Exchange Rate Source	Source of Exchange Rate for triangulation from original currency to triangulation currency at time of original transaction - for example, Reuters, Bloomberg	原取引通貨トライアンギュレーション通貨換算レート情報源
muc-16	335	4	muc	originalExchangeRateTriangulationType	exchangeRateTypeItemType	Original to Triangulation Currency Exchange Rate Type	Type of Exchange Rate for triangulation from original currency to triangulation currency at time of original transaction - for example, spot rate, forward contract etc.	原取引通貨トライアンギュレーション通貨換算レート種別
cor-41	336	4	cor	signOfAmount	gl-gen:signOfAmountItemType	Sign Indication for Amount	Sign of amount; provides 4 possible fields only when used in conjunction with debitCreditCode; primarily used for correcting entries so total debits and credits after an entry error are not inflated. D + increase DebitsD - decrease debitsC + decreases creditC - increases credit	金額符号
cor-42	337	4	cor	debitCreditCode	gl-gen:debitCreditCodeItemType	Debit/Credit Identifier	Optional identifier of whether the amount is a (D)ebit, a (C)redit or Undefined	貸借区分コード
cor-43	338	4	cor	postingDate	postingDateItemType	Posting Date	At the detail level, this represents the accounting significance date. No matter what date the document is received, entered, or posted, this signifies the accounting date of the entry. If you want to see the financial results for March 5, 2002 and this entry is given that date, the entry will be part of the results for March 5, 2002. This is different from the postedDate found at the entryHeader level. If you want the accounting significance to be a particular date, it goes here. A single entry could represent multiple dates, but would only be posted on one date.	転記日付
bus-118	339	4	bus	amountMemo	amountMemoItemType	Memo Line	A boolean like entry that indicates whether an entryDetail line has been provided solely to provide additional details and that tools should not consider the amount in postings.	メモ行フラグ
cenG-27	340	4	cen	INVOICE_LINE_ALLOWANCES	_	INVOICE LINE ALLOWANCES	A group of business terms providing information about allowances applicable to the individual Invoice line.	_
cen-136	341	5	cen	InvoiceLineAllowanceAmount	amountItemType	Invoice line allowance amount	The amount of an allowance, without VAT.	
cen-137	342	5	cen	InvoiceLineAllowanceBaseAmount	amountItemType	Invoice line allowance base amount	The base amount that may be used, in conjunction with the Invoice line allowance percentage, to calculate the Invoice line allowance amount.	_
cen-138	343	5	cen	InvoiceLineAllowancePercentage	percentageItemType	Invoice line allowance percentage	The percentage that may be used, in conjunction with the Invoice line allowance base amount, to calculate the Invoice line allowance amount	_
cen-139	344	5	cen	InvoiceLineAllowanceReason	textItemType	Invoice line allowance reason	The reason for the Invoice line allowance, expressed as text.	_
cen-140	345	5	cen	InvoiceLineAllowanceReasonCode	codeItemType	Invoice line allowance reason code	The reason for the Invoice line allowance, expressed as a code.	_
cenG-28	346	4	cen	INVOICE_LINE_CHARGES	_	INVOICE LINE CHARGES	A group of business terms providing information about charges and taxes other than VAT applicable to the individual Invoice line.	_
cen-141	347	5	cen	InvoiceLineChargeAmount	amountItemType	Invoice line charge amount	The amount of a charge, without VAT.	
cen-142	348	5	cen	InvoiceLineChargeBaseAmount	amountItemType	Invoice line charge base amount	The base amount that may be used, in conjunction with the Invoice line charge percentage, to calculate the Invoice line charge amount.	_
cen-143	349	5	cen	InvoiceLineChargePercentage	percentageItemType	Invoice line charge percentage	The percentage that may be used, in conjunction with the Invoice line charge base amount, to calculate the Invoice line charge amount.	_
cen-144	350	5	cen	InvoiceLineChargeReason	textItemType	Invoice line charge reason	The reason for the Invoice line charge, expressed as text.	_
cen-145	351	5	cen	InvoiceLineChargeReasonCode	codeItemType	Invoice line charge reason code	The reason for the Invoice line charge, expressed as a code.	_
cen-154	352	5	cen	ItemDescription	textItemType	Item description	A description for an item.	_
bus-119	353	4	bus	allocationCode	allocationCodeItemType	Allocation Code	Code associated with the calculation formula: e.g. (D)ivide by number of periods, (T)otal for period given	配分コード
mucG-1	354	4	muc	multicurrencyDetail	_	Multicurrency Detail	Section to provide additional information related to home currencies that differ from original currencies and related exchange rates - typically this will be used to record exchange rates and amounts in currencies and/or on dates other than those of the original transaction. This structure allows recording of exchange rates using a third currency as a triangulation currency. This is often EUR but is not restricted to being so. This structure may be repeated as many times as necessary to record amounts in foreign currencies on the same or different dates.	【多通貨明細】
muc-17	355	5	muc	multicurrencyDetailExchangeRateDate	exchangeRateDateItemType	Date of Exchange Rate	Date of exchange rate (other than original transaction date) on which amount is expressed as amountRestatedAmount or amountTriangulationAmount	換算レート日付
muc-18	356	5	muc	amountRestatedAmount	gl-gen:amountItemType	Restated Amount	The amount in the foreign currency identified by amountRestatedCurrency as of multicurrencyDetailExchangeRateDate.	換算額
muc-19	357	5	muc	amountRestatedCurrency	currencyItemType	Currency of Restated Amount	The currency in which amountRestatedAmount is expressed. Recommended ISO 4217 coding.	換算通貨
muc-20	358	5	muc	amountRestatedExchangeRate	exchangeRateItemType	Restated Amount Exchange Rate	Exchange rate used to convert amountRestatedAmount as of multicurrencyDetailExchangeRateDate (expressed as national currency divided by foreign currency)	換算レート
muc-21	359	5	muc	amountRestatedExchangeRateSource	exchangeRateSourceItemType	Restated Amount Exchange Rate Source	Source of Exchange Rate for restated amount - for example, Reuters, Bloomberg	換算レート情報源
muc-22	360	5	muc	amountRestatedExchangeRateType	exchangeRateTypeItemType	Restated Amount Exchange Rate Type	Type of Exchange Rate for restated amount - for example, spot rate, forward contract etc.	換算レート種別
muc-23	361	5	muc	amountTriangulationAmount	gl-gen:amountItemType	Amount in Triangulation Currency	The amount in the triangulation currency identified by amountTriangulationCurrency as of multicurrencyDetailExchangeRateDate.	トライアンギュレーション通貨換算額
muc-24	362	5	muc	amountTriangulationCurrency	currencyItemType	Triangulation Currency	The currency used for tringulation between amountRestatedCurrency and the home currency. Recommended ISO 4217 coding.	トライアンギュレーション通貨
muc-25	363	5	muc	amountTriangulationExchangeRate	exchangeRateItemType	Triangulation Exchange Rate	Exchange rate used to convert amountTriangulationAmount as of multicurrencyDetailExchangeRateDate (expressed as national currency divided by triangulation currency)	トライアンギュレーション通貨換算レート
muc-26	364	5	muc	amountTriangulationExchangeRateSource	exchangeRateSourceItemType	Triangulation Exchange Rate Source	Source of Exchange Rate for triangulation amount - for example, Reuters, Bloomberg	トライアンギュレーション通貨換算レート情報源
muc-27	365	5	muc	amountTriangulationExchangeRateType	exchangeRateTypeItemType	Triangulation Exchange Rate Type	Type of Exchange Rate for triangulation amount - for example, spot rate, forward contract etc.	トライアンギュレーション通貨換算レート種別
muc-28	366	5	muc	restatedTriangulationExchangeRate	exchangeRateItemType	Restated Triangulation Exchange Rate	Exchange rate used to convert from amountRestatedAmount to amountTriangulationAmount as of multicurrencyDetailExchangeRateDate (expressed as foreign currency divided by triangulation currency)	換算通貨トライアンギュレーション通貨換算レート
muc-29	367	5	muc	restatedExchangeRateTriangulationSource	exchangeRateSourceItemType	Restated Triangulation Exchange Rate Source	Source of Exchange Rate for converting between foreign currency and triangulation currency - for example, Reuters, Bloomberg	換算通貨トライアンギュレーション通貨換算レート情報源
muc-30	368	5	muc	restatedExchangeRateTriangulationType	exchangeRateTypeItemType	Restated Triangulation Exchange Rate Type	Type of Exchange Rate for converting between foreign currency and triangulation currency - for example, spot rate, forward contract etc.	換算通貨トライアンギュレーション通貨換算レート種別
muc-31	369	5	muc	multicurrencyDetailComment	commentItemType	Multicurrency Detail Comment	Comment describing the enclosing multicurrencyDetail tuple's contents. May include reason for recording additional exchange rates other than that used at the time of the original transaction.	多通貨明細コメント
cor-73	370	4	cor	documentType	gl-gen:documentTypeItemType	Document Type	An enumerated field describing the original source document, with invoice, voucher, check and other enumerated entries	元文書種別
cor-74	371	4	cor	documentTypeDescription	documentTypeDescriptionItemType	Document Type Description	Free format description of the document type	元文書種別説明
cor-75	372	4	cor	invoiceType	gl-gen:invoiceTypeItemType	Invoice Type	Invoice Type  (self-billed, ePoS enumerated values)	請求書種別
cor-76	373	4	cor	documentNumber	documentNumberItemType	Document Number	Invoice, check, voucher, or other source document identifier	元文書番号
cor-77	374	4	cor	documentApplyToNumber	documentApplyToNumberItemType	Apply To Number	Document number of primary invoice number, used to offset payments, debits and credits; for an invoice, usually the same as the documentNumber. When calculating open balance on an invoice, or open amount on payments in advance or not fully applied, this permits calculation of the open item.	適用先番号
cor-78	375	4	cor	documentReference	documentReferenceItemType	Document Reference	Internal reference for the document above; number assigned internally to track the document	元文書参照情報
cor-79	376	4	cor	documentDate	documentDateItemType	Document Date	Date (and less likely in the paper world but possible in the e-world, time) on actual document (invoice, voucher, check date). Other dates control posting information.	元文書日付
bus-132	377	4	bus	documentReceivedDate	documentReceivedDateItemType	Received Date	Date/time document was noted as received (if necessary). Represents actual date received. Posting dates are maintained separately.	元文書受領日付
bus-133	378	4	bus	documentChargeReimb	documentChargeReimbItemType	Chargeable or Reimbursable	Is this entry chargeable to client, reimbursable? Used by some systems to indicate that account on posting/validation should be posted to a customer or vendor's account.	請求支払可能フラグ
bus-134	379	4	bus	documentLocation	documentLocationItemType	Document Location	Document location as URI, file name or other reference. Alternatively, text of document can be placed here.	元文書格納場所
bus-135	380	4	bus	paymentMethod	paymentMethodItemType	Payment Method	Method used or to be used to make the payment	支払方法
cor-80	381	4	cor	postingStatus	gl-gen:postingStatusItemType	Posting Status	deferred: although entered, it cannot be posted until a later time\nposted: already posted\nproposed: a proposed item that must be approved\nsimulated: a simulated item, for what-if\ntax: a tax-specific entry\nunposted:entered but not yet posted or validated\ncancelled:entered and later cancelled\nother:other status - should be described in postingStatusDescription	転記状態
cor-81	382	4	cor	postingStatusDescription	postingStatusDescriptionItemType	Posting Status Description	Free format description of the posting status	転記状態説明
corG-18	383	4	cor	xbrlInfo	_	XBRL Information	This will roll up to XBRL reporting information - this is a parent - repeatable so that the same item can be reported through many taxonomies. Care should be taken to consider what happens if people post to the same account but different XBRL elements.	【XBRL情報】
cor-82	384	5	cor	xbrlInclude	gl-gen:xbrlIncludeItemType	XBRL Allocation	Indicates that the information being given is beginning_balance, ending_balance, period_change.	XBRL割当
cor-83	385	5	cor	summaryReportingElement	summaryReportingElementItemType	Summary Reporting Element	Associated XBRL element or XML element within an XML taxonomy - mapping to an XBRL concept.	集約報告エレメント
cor-84	386	5	cor	detailMatchingElement	detailMatchingElementItemType	Detail Matching Element	Associated XBRL element in XBRL-GL instance.	明細対応エレメント
srcd-5	387	5	srcd	summaryTuplePath	summaryTuplePathItemType	Summary Tuple Path	Specific filter for parent tuple structure. This value must be valid XPath. And the result of the XPath must be resolved to a node.	集約タプルパス
