code	0	level	module	term	type	label	description	label-ja
bus-83	140	5	bus	accountantLocationIdentifierCrossReference	locationIdentifierItemType	Accountant Location ID cross reference	This code is used to associate the contact with a specific location for the Accountant. Its value should be the same as that of the accountantAddressLocationIdentifier	会計士所在地相互参照情報
bus-84	141	5	bus	accountantContactActive	gl-gen:activeItemType	Accountant Contact Active	Boolean to indicate whether the contact is active (="true") or inactive (="false")	会計士担当者有効性
corG-9	142	3	cor	identifierReference	_	Identifier Reference	Identification for customer, vendor, or employee.	【CVE情報】
cor-44	143	4	cor	identifierCode	identifierCodeItemType	ID Number (internal)	Internal ID Number associated with identifierReference	CVE識別番号（内部）
corG-10	144	4	cor	identifierExternalReference	_	External Authority	Structure containing references to an external authority associated with identifier	【外部機関】
cor-45	145	5	cor	identifierAuthorityCode	identifierAuthorityCodeItemType	External Authority ID Number	External Authority (e,g, Tax Authority) ID Number associated with identifierReference	外部機関付与識別番号
cor-46	146	5	cor	identifierAuthority	identifierAuthorityItemType	External Authority	Name of External Authority (e.g. Tax Authority)	外部機関名
cor-47	147	5	cor	identifierAuthorityVerificationDate	identifierAuthorityVerificationDateItemType	External Authority Verification Date	Date on which the External Authority last performed a verification	外部機関認証日付
cor-48	148	4	cor	identifierOrganizationType	gl-gen:identifierOrganizationTypeItemType	Identifier Organization Type	Identifier Organization Type	CVE組織種別
cor-49	149	4	cor	identifierOrganizationTypeDescription	identifierOrganizationTypeDescriptionItemType	Identifier Organization Type Description	Free format description of the identifier organization type	CVE組織種別説明
cen-28	150	4	cen	tradingName	textItemType	Trading name	A name by which the Seller/Buyer is known, other than Seller/Buyer name (also known as Business name].	
cen-33	151	4	cen	additionalLegalInformation	textItemType	Seller additional legal information	Additional legal information relevant for the entity.	_
cor-50	152	4	cor	identifierDescription	identifierDescriptionItemType	Identifier Description	Textual description of identifierReference.	CVE説明
cor-51	153	4	cor	identifierType	gl-gen:identifierTypeItemType	Identifier Type	Entity type (enumerated): e.g., customer, vendor, employee.	CVE種別
cor-52	154	4	cor	identifierCategory	identifierCategoryItemType	Identifier Category	For use as Customer, Vendor or Employee Class (such as Residential/Commercial/Institutional/Government or Retail/Wholesale or other classifications used by business).	CVEカテゴリ
corG-11	155	4	cor	identifierEMail	_	Email Address	Email address for Identifier.	【Eメールアドレス】
cor-53	156	5	cor	identifierEmailAddressUsage	gl-gen:emailAddressUsageItemType	Identifer Email Address Usage	Identifer Email Address Usage (e.g. Orders, Head Office, IR)	CVEEメールアドレス用途
cor-54	157	5	cor	identifierEmailAddress	gl-gen:emailAddressItemType	Identifer Email Address	Identifer Email Address	CVEEメールアドレス
corG-12	158	4	cor	identifierPhoneNumber	_	Phone Number	Phone number related to Identifier.	【電話番号】
cor-55	159	5	cor	identifierPhoneNumberDescription	gl-gen:phoneNumberDescriptionItemType	Identifier Phone Number Usage	Identifier Phone Number Usage (e.g. Main, Investor relations, etc.)	CVE電話番号用途
cor-56	160	5	cor	identifierPhone	gl-gen:phoneNumberItemType	Identifier Phone Number	Identifier Phone Number	CVE電話番号
corG-13	161	4	cor	identifierFaxNumber	_	Fax Number Structure	Fax number structure related to identifier.	【FAX番号】
cor-57	162	5	cor	identifierFaxNumberUsage	gl-gen:faxNumberUsageItemType	Identifer Fax Number Usage	Identifer Fax Number Usage (e.g. Orders, Head Office, IR)	CVEFAX番号用途
cor-58	163	5	cor	identifierFax	gl-gen:faxNumberItemType	Identifer Fax Number	Identifer Fax Number	CVEFAX番号
bus-120	164	4	bus	identifierPurpose	identifierPurposeItemType	Identifier Purpose	Freeform for codes like purchasing, billing, manufacturing at identifier level.	CVE目的
busG-20	165	4	bus	identifierAddress	_	Address	Address (block) of customer, vendor, employee for integration purposes, VAT.	【CVE住所】
bus-121	166	5	bus	identifierAddressDescription	identifierAddressDescriptionItemType	Identifier Address Description	For use when the addressee identifier for this address is different than the primary description of the identified party.	CVE住所説明
bus-122	167	5	bus	identifierAddressPurpose	identifierAddressPurposeItemType	Identifier Address Purpose	Freeform for codes like shipping, billing, mailing at address level.  Allows identification of multiple purpose addresses for each identifier.	CVE住所目的
bus-123	168	5	bus	identifierBuildingNumber	identifierBuildingNumberItemType	Building Number	Building Number for Identifier Address	CVE住所建物番号
bus-124	169	5	bus	identifierStreet	identifierStreetItemType	Street	Street address.	CVE住所通り
bus-125	170	5	bus	identifierAddressStreet2	identifierAddressStreet2ItemType	Address Detail	Address Detail for Identifier Address	CVE住所詳細
cen-162	171	5	cen	AddressLine3	textItemType	Address line 3	An additional address line in an address that can be used to give further details supplementing the main line.	
bus-126	172	5	bus	identifierCity	identifierCityItemType	City	City	CVE住所都市
bus-127	173	5	bus	identifierStateOrProvince	identifierStateOrProvinceItemType	State or Province	State or province	CVE住所州
bus-128	174	5	bus	identifierCountry	identifierCountryItemType	Country	Country	CVE住所国
bus-129	175	5	bus	identifierZipOrPostalCode	identifierZipOrPostalCodeItemType	Zip or Postal Code	Zip or other postal code	CVE住所郵便番号
bus-130	176	5	bus	identifierAddressLocationIdentifier	locationIdentifierItemType	Identifier Address Location ID	A code used to identify the identifier and to associate it with contacts	CVE所在地識別子
corG-14	177	4	cor	identifierContactInformationStructure	_	Identifier Contact Information Structure	Identifier Contact Information Structure	【CVE担当者情報】
cor-59	178	5	cor	identifierContactPrefix	identifierContactPrefixItemType	Identifier Contact Prefix	Prefix (e.g. Dr., Mr., Mrs.)	CVE担当者敬称
cor-60	179	5	cor	identifierContactLastName	identifierContactLastNameItemType	Identifier Contact Last Name	Identifier Contact Last or Family Name	CVE担当者姓
cor-61	180	5	cor	identifierContactFirstName	identifierContactFirstNameItemType	Identifier Contact First Name	First or given name	CVE担当者名
cor-62	181	5	cor	identifierContactSuffix	identifierContactSuffixItemType	Identifier Contact Suffix	Suffix (e.g. MD, CPA, Jr.)	CVE担当者付加名称\n
cor-63	182	5	cor	identifierContactAttentionLine	identifierContactAttentionLineItemType	Identifier Contact Attention Line	Attention Line	CVE担当者アテンションライン
cor-64	183	5	cor	identifierContactPositionRole	identifierContactPositionRoleItemType	Identifier Contact Position/Role	Position or Role	CVE担当者地位/役職
corG-15	184	5	cor	identifierContactPhone	_	Identifier Contact Phone	Phone Number	【CVE担当者電話番号】
cor-65	185	6	cor	identifierContactPhoneNumberDescription	gl-gen:phoneNumberDescriptionItemType	Identifier Contact Phone Number Usage	Identifier Contact Phone Number Usage (Main, Investor Relations, etc.)	CVE担当者電話番号用途
cor-66	186	6	cor	identifierContactPhoneNumber	gl-gen:phoneNumberItemType	Identifier Contact Phone Number	Identifier Contact Phone Number	CVE担当者電話番号
corG-16	187	5	cor	identifierContactFax	_	Identifier Contact Fax Number	Fax Number	【CVE担当者FAX番号】
cor-67	188	6	cor	identifierContactFaxNumberUsage	gl-gen:faxNumberUsageItemType	Identifer Contact Fax Number Usage	Identifer Contact Fax Number Usage (e.g. Orders, Head Office, IR)	CVE担当者FAX番号用途
cor-68	189	6	cor	identifierContactFaxNumber	gl-gen:faxNumberItemType	Identifer Contact Fax Number	Identifer Contact Fax Number	CVE担当者FAX番号
corG-17	190	5	cor	identifierContactEmail	_	Identifier Contact Email Address	Email Address	【CVE担当者Eメールアドレス】
cor-69	191	6	cor	identifierContactEmailAddressUsage	gl-gen:emailAddressUsageItemType	Identifer Contact Email Address Usage	Identifer Contact Email Address Usage (e.g. Orders, Head Office, IR)	CVE担当者Eメールアドレス用途
cor-70	192	6	cor	identifierContactEmailAddress	gl-gen:emailAddressItemType	Identifer Contact Email Address	Identifer Contact Email Address	CVE担当者Eメールアドレス
cen-49	193	5	cen	ElectronicAddress	textItemType	Electronic address	Identifies the electronic address to which the application level response to the invoice may be delivered.	
cor-71	194	5	cor	identifierContactType	identifierContactTypeItemType	Identifier Contact Type	Identifier Contact Type	CVE担当者種別
bus-131	195	5	bus	identifierLocationIdentifierCrossReference	locationIdentifierItemType	Identifier Address Location ID Cross Reference	This code is used to associate the contact with a specific location for the Identifier. Its value should be the same as that of the identifierAddressLocationIdentifier	CVE所在地相互参照情報
cor-72	196	4	cor	identifierActive	gl-gen:activeItemType	Identifier Active	Boolean to indicate whether the identifier is active (="true") or inactive (="false")	CVE有効性
busG-18	197	3	bus	reportingCalendar	_	Reporting Calendar	A tool to collect the periods used to summarise results from transactions.	【報告カレンダー】
bus-85	198	4	bus	reportingCalendarCode	reportingCalendarCodeItemType	Reporting Calendar Code	The code used to identify this specific reporting calendar, unique across periods	報告カレンダーコード
bus-86	199	4	bus	reportingCalendarDescription	reportingCalendarDescriptionItemType	Reporting Calendar Description	A description of the reporting calendar (associated with the reportingCalendarCode given)	報告カレンダー説明
bus-87	200	4	bus	reportingCalendarTitle	reportingCalendarTitleItemType	Reporting Calendar Title	A description of the reporting period. The actual beginning and ending dates are found within the 'reportingCalendarPeriod' structure	報告カレンダータイトル
bus-88	201	4	bus	reportingCalendarPeriodType	reportingCalendarPeriodTypeItemType	Code Related to Type of Periods	A code for the type of period involved. Enumerated as: monthly, quarterly, semi-annually, 4-5-4, ad-hoc, other.	期間種別コード
bus-89	202	4	bus	reportingCalendarPeriodTypeDescription	reportingCalendarPeriodTypeDescriptionItemType	Description of periods	A description of the type of period involved.	期間種別説明
bus-90	203	4	bus	reportingCalendarOpenClosedStatus	reportingCalendarOpenClosedStatusItemType	Closed status	An identifier on whether the reporting calendar is still open for activity. enumerated, "open", "closed", "pending"	締状態
bus-91	204	4	bus	reportingPurpose	accountingMethodPurposeItemType	Reporting Purpose	A description of the accounting set of books involved. Uses enumeration from accounting method purpose.	報告目的
bus-92	205	4	bus	reportingPurposeDescription	reportingPurposeDescriptionItemType	Reporting Purpose Description	Free format description of the reporting purpose	報告目的説明
cenG-14	206	4	cen	INVOICING_PERIOD	textItemType	INVOICING PERIOD	A group of business terms providing information on the invoice period.	_
cen-73	207	5	cen	periodStartDate	dateItemType	Invoicing period start date	The date when the Invoice period starts.	_
cen-74	208	5	cen	periodEndDate	dateItemType	Invoicing period end date	The date when the Invoice period ends.	_
busG-19	209	4	bus	reportingCalendarPeriod	_	Reporting Calendar Period	A tool to collect a specific set of periods used to summarize results from transactions.	【報告カレンダー期間】
bus-93	210	5	bus	periodIdentifier	periodIdentifierItemType	Reporting Period Identifier	An identifier for this period in this calendar	報告期間識別子
bus-94	211	5	bus	periodDescription	periodDescriptionItemType	Period Description	A description of this specific reporting period in this calendar.	期間説明
bus-95	212	5	bus	periodStart	periodStartItemType	Period Start Date	The beginning date/time of a period	期間開始日付
bus-96	213	5	bus	periodEnd	periodEndItemType	Period End Date	The ending date/time of a period	期間終了日付
bus-97	214	5	bus	periodClosedDate	periodClosedDateItemType	Period Closed Date	The date/time a period has been closed for activity. If this is present with a nill value (xsi:nill="true") then the period is not closed.	期間締日付
corG-4	215	2	cor	entryHeader	_	Entry Information	Parent for entry headers/journal entry headers.	【仕訳情報】
cor-10	216	3	cor	postedDate	postedDateItemType	Date Posted	Date this entry was posted (validated) to the general ledger. May not represent the date of accounting significance which is represented by 'postingDate'.	転記済日付
cor-11	217	3	cor	enteredBy	enteredByItemType	Entry Creator	Initials/name of operator originally entering.	仕訳作成者
bus-98	218	3	bus	enteredByModified	enteredByModifiedItemType	Entry Last Modifier	Identification for the last person modifying this entry before posting.	仕訳最終更新者
cor-12	219	3	cor	enteredDate	enteredDateItemType	Entry Date	Represents the actual date/time of entry into computer (automated from system date, often misrepresented by changing system clock). Posting dates are maintained separately.	入力日付
bus-99	220	3	bus	entryResponsiblePerson	entryResponsiblePersonItemType	Responsible Person	Identifier of person who created or originated or is otherwise responsible for the entry.	責任者
cor-13	221	3	cor	sourceJournalID	gl-gen:sourceJournalIDItemType	Source Journal	Source journal. The code of the journal in which the entry is processed. The code must be a unique indication for a journal and is selected from the following enumerated list:\ncd      cash disbursements (sending cheques to vendors)\ncr      cash receipts (receiving cheques from others)\nfa      fixed assets\ngi      giro/other bank adjustments\ngj      general journal\nim      inventory management\njc      job cost\npj      purchase journal (liabilities from purchases)\npl      payroll journal\nsj      sales journal\nse      standard entries\nud      user defined\not      other sources of entries"	元仕訳帳種別
bus-100	222	3	bus	sourceJournalDescription	sourceJournalDescriptionItemType	Journal Description	Source journal (full description of general journal, payroll journal, accountant entries). A more easily readable journal indication. The most common journals are: Purchases, Sales, Cash, and General Journal.	元仕訳帳説明
cor-14	223	3	cor	entryType	gl-gen:entryTypeItemType	Type Identifier	One of the following enumerated list: adjusting, budget, comparative, external-accountant, standard, passed-adjusting, eliminating, proposed, recurring, reclassifying, simulated, tax, other	種別識別子
bus-101	224	3	bus	entryOrigin	entryOriginItemType	Entry Origin	Origin of entry: accrual, manual entry, imported entry, exchange gain or loss	仕訳起源
cor-15	225	3	cor	entryNumber	entryNumberItemType	Entry Identifier	Identifier within source journal	仕訳識別子
cor-16	226	3	cor	entryComment	entryCommentItemType	Entry Description	Description of entry described by this entry header (e.g. Opening Balance)	仕訳説明
cor-17	227	3	cor	qualifierEntry	gl-gen:qualifierEntryItemType	Entry Qualifier	Entry Qualifier - An enumerated field that qualifies the type of entry, specifically useful for general ledger and trial balance environments when it is important to state the values represented are summarized as of the reporting date - opening or closing balances. In accounting systems, this is often known as BBF (balance brought forward.) Permitted values are: standard, balance-brought-forward and other.	仕訳修飾子
cor-18	228	3	cor	qualifierEntryDescription	qualifierEntryDescriptionItemType	Entry Qualifier Description	Free format description of the entry qualifier	仕訳修飾子説明
bus-102	229	3	bus	postingCode	postingCodeItemType	Posting Code	Code for posting to period, e.g., period 1-13, based on codes in an accounting period file. We do not recommend that software vendors export here, but suggest providing period end numbers for the buckets. Possibilities W1 through W53, M1 through M13, Q1-Q4. Developers and others creating output files are encouraged to supply an actual end date.	転記コード
bus-103	230	3	bus	batchID	batchIDItemType	Batch ID for Entry Group	ID for a batch for this group of entries	仕訳グループ識別子
bus-104	231	3	bus	batchDescription	batchDescriptionItemType	Batch Description	Description of this batch	仕訳グループ説明
bus-105	232	3	bus	numberOfEntries	numberOfEntriesItemType	Number of Entries	The total number of entries.	仕訳総数
bus-106	233	3	bus	totalDebit	totalDebitItemType	Total Debits	The total of all debit amounts.	借方合計
bus-107	234	3	bus	totalCredit	totalCreditItemType	Total Credits	The total of all credit amounts.	貸方合計
cor-19	235	3	cor	bookTaxDifference	gl-gen:bookTaxDifferenceItemType	Type of Difference Between Book and Tax	Enumerated field with possible values of permanent, temporary or none indicating the type of difference between book and tax accounting methods. Omission of this field is equivalent to "none"	帳簿価税務簿価差異種別
bus-108	236	3	bus	eliminationCode	eliminationCodeItemType	Elimination Code	Informs destination ledger this is an intracompany entry which eliminates in consolidation	相殺消去コード
bus-109	237	3	bus	budgetScenarioPeriodStart	budgetScenarioPeriodStartItemType	Budget Scenario Period Start	Start of period covered by associated budgetScenario	予算シナリオ期間開始日付
bus-110	238	3	bus	budgetScenarioPeriodEnd	budgetScenarioPeriodEndItemType	Budget Scenario Period End	End of period covered by associated budgetScenario	予算シナリオ期間終了日付
bus-111	239	3	bus	budgetScenarioText	budgetScenarioTextItemType	Scenario Description	Text related to budgetScenario	シナリオ説明
bus-112	240	3	bus	budgetScenario	budgetScenarioItemType	Scenario Code	Code for a budget scenario identifier (such as PB for 'preliminary budget', or RB for 'revised budget', or other identifier for entryType)	シナリオコード
bus-113	241	3	bus	budgetAllocationCode	budgetAllocationCodeItemType	Budget Allocation Code	Code associated with the calculation formula: e.g. (D)ivide by number of periods, (T)otal for period given	予算配分コード
usk-1	242	3	usk	reversingStdId	reversingStdIdItemType	ID for Reversing, Standard or Master Entry	For standard, reversing, master, cancelling or other entries an ID associated with those entries.	反対/通常/マスタ仕訳識別子
usk-2	243	3	usk	recurringStdDescription	recurringStdDescriptionItemType	Recurring Standard Description	Description to accompany standard or recurring ID	反復通常仕訳説明
usk-3	244	3	usk	frequencyInterval	frequencyIntervalItemType	Frequency Interval	For standard or recurring journals, how often entry may be made: every frequencyInterval frequencyUnit, such as every 7 (interval) days (unit) or every 1 (interval) quarter (unit). This field represents the interval.\n	頻度間隔
usk-4	245	3	usk	frequencyUnit	frequencyUnitItemType	Frequency Unit	For standard or recurring journals, how often entry may be made: every frequencyInterval frequencyUnit, such as every 7 (interval) days (unit) or every 1 (interval) quarter (unit). This field represents the unit.\n	頻度単位
usk-5	246	3	usk	repetitionsRemaining	repetitionsRemainingItemType	Repetitions Remaining	Number of times that the recurring entry will repeat	反復残回数
usk-6	247	3	usk	nextDateRepeat	nextDateRepeatItemType	Next Date Repeat	Date next repeated or standard posted	次回反復日付
usk-7	248	3	usk	lastDateRepeat	lastDateRepeatItemType	Last Date Repeat	Date last repeated or standard posted	前回反復日付
usk-8	249	3	usk	endDateRepeatingEntry	endDateRepeatingEntryItemType	End Date of Repeating Entry	For standard or recurring journals, stop date/time for repetitive entry.	反復仕訳終了日付
usk-9	250	3	usk	reverse	reverseTypeItemType	Reverse	Should entry be reversed?	反対仕訳要否
usk-10	251	3	usk	reversingDate	reversingDateItemType	Reversing Date	Date this entry should be reversed	反対仕訳日付
cor-20	252	3	cor	entryNumberCounter	counterItemType	Entry Number Counter	Unique reference for the entry - a numeric counter	仕訳番号カウンタ
cenG-20	253	3	cen	DOCUMENT_LEVEL_ALLOWANCES	_	DOCUMENT LEVEL ALLOWANCES	A group of business terms providing information about allowances applicable to the Invoice as a whole.	_
cen-93	254	4	cen	DocumentLevelAllowanceBaseAmount	amountItemType	Document level allowance base amount	The base amount that may be used, in conjunction with the document level allowance percentage, to calculate the document level allowance amount.	_
cen-94	255	4	cen	DocumentLevelAllowancePercentage	percentageItemType	Document level allowance percentage	The percentage that may be used, in conjunction with the document level allowance base amount, to calculate the document level allowance amount.	_
cen-97	256	4	cen	DocumentLevelAllowanceReason	textItemType	Document level allowance reason	The reason for the document level allowance, expressed as text	_
cen-98	257	4	cen	DocumentLevelAllowanceReasonCode	codeItemType	Document level allowance reason code	The reason for the document level allowance, expressed as a code.	_
cenG-21	258	3	cen	DOCUMENT_LEVEL_CHARGES	_	DOCUMENT LEVEL CHARGES	A group of business terms providing information about charges and taxes other than VAT, applicable to the Invoice as a whole.	_
cen-100	259	4	cen	DocumentLevelChargeBaseAmount	amountItemType	Document level charge base amount	The base amount that may be used, in conjunction with the document level charge percentage, to calculate the document level charge amount.	_
cen-101	260	4	cen	DocumentLevelChargePercentage	percentageItemType	Document level charge percentage	The percentage that may be used, in conjunction with the document level charge base amount, to calculate the document level charge amount	_
cen-104	261	4	cen	DocumentLevelChargeReason	textItemType	Document level charge reason	The reason for the document level charge, expressed as text.	_
cen-105	262	4	cen	DocumentLevelChargeReasonCode	codeItemType	Document level charge reason code	The reason for the document level charge, expressed as a code.	_
cenG-22	263	3	cen	DOCUMENT_TOTALS	_	DOCUMENT TOTALS	A group of business terms providing the monetary totals for the Invoice.	_
cen-106	264	4	cen	SumOfInvoiceLineNetAmount	amountItemType	Sum of Invoice line net amount	Sum of all Invoice line net amounts in the Invoice.	
cen-107	265	4	cen	SumOfAllowancesOnDocumentLevel	amountItemType	Sum of allowances on document level	Sum of all allowances on document level in the Invoice.	_
cen-108	266	4	cen	SumOfChargesOnDocumentLevel	amountItemType	Sum of charges on document level	Sum of all charges on document level in the Invoice.	_
cen-109	267	4	cen	InvoiceTotalAmountWithoutVAT	amountItemType	Invoice total amount without VAT	The total amount of the Invoice without VAT.	_
cen-111	268	4	cen	InvoiceTotalVATAmountInAccountingCurrency	amountItemType	Invoice total VAT amount in accounting currency	The VAT total amount expressed in the accounting currency accepted or required in the country of the Seller.	_
cen-112	269	4	cen	InvoiceTotalAmountWithVAT	amountItemType	Invoice total amount with VAT	The total amount of the Invoice with VAT.	_
cen-113	270	4	cen	PaidAmount	amountItemType	Paid amount	The sum of amounts which have been paid in advance.	_
cen-114	271	4	cen	RoundingAmount	amountItemType	Rounding amount	The amount to be added to the invoice total to round the amount to be paid.	_
cen-115	272	4	cen	AmountDueForPayment	amountItemType	Amount due for payment	The outstanding amount that is requested to be paid.	_
cenG-23	273	3	cen	VAT_BREAKDOWN	_	VAT BREAKDOWN	A group of business terms providing information about VAT breakdown by different categories, rates and exemption reasons	_
cen-116	274	4	cen	VATCategoryTaxableAmount	amountItemType	VAT category taxable amount	Sum of all taxable amounts subject to a specific VAT category code and VAT category rate (if the VAT category rate is applicable].	
cen-117	275	4	cen	VATCategoryTaxAmount	amountItemType	VAT category tax amount	The total VAT amount for a given VAT category.	
cen-118	276	4	cen	Vatcategorycode	codeItemType	VAT category code	Coded identification of a VAT category.	
cen-119	277	4	cen	VATCategoryRate	percentageItemType	VAT category rate	The VAT rate, represented as percentage that applies for the relevant VAT category.	
cen-120	278	4	cen	VATExemptionReasonText	textItemType	VAT exemption reason text	A textual statement of the reason why the amount is exempted from VAT or why no VAT is being charged	_
cen-121	279	4	cen	VATExemptionReasonCode	codeItemType	VAT exemption reason code	A coded statement of the reason for why the amount is exempted from VAT.	_
cenG-24	280	3	cen	ADDITIONAL_SUPPORTING_DOCUMENTS	_	ADDITIONAL SUPPORTING DOCUMENTS	A group of business terms providing information about additional supporting documents substantiating the claims made in the Invoice.	_
cen-122	281	4	cen	SupportingDocumentReference	documentReferenceItemType	Supporting document reference	An identifier of the supporting document.	_
cen-123	282	4	cen	SupportingDocumentDescription	textItemType	Supporting document description	A description of the supporting document	_
