cor-20	2	cor	entryNumberCounter	counterItemType	Entry Number Counter	Unique reference for the entry - a numeric counter	仕訳番号カウンタ	仕訳の一意なリファレンス　　カウンタ
cenG-1	2	cen	INVOICE_NOTE	xbrli:stringItemtype	INVOICE NOTE	_	_	_
cen-21	3	cen	InvoiceNoteSubjectCode	codeItemType	Invoice note subject code	_	_	_
cen-22	3	cen	InvoiceNote	textItemType	Invoice note	_	_	_
cenG-2	2	cen	PROCESS_CONTROL	xbrli:stringItemtype	PROCESS CONTROL	_	_	_
cen-23	3	cen	BusinessProcessType	textItemType	Business process type	_	_	_
cen-24	3	cen	SpecificationIdentifier	identifierItemType	Specification identifier	_	_	_
cenG-3	2	cen	PRECEDING_INVOICE_REFERENCE	xbrli:stringItemtype	PRECEDING INVOICE REFERENCE	_	_	_
cen-28	3	cen	SellerTradingName	textItemType	Seller trading name	_	_	_
cen-33	3	cen	SellerAdditionalLegalInformation	textItemType	Seller additional legal information	_	_	_
cen-162	4	cen	SellerAddressLine3	textItemType	Seller address line 3	_	_	_
cen-45	4	cen	BuyerTradingName	textItemType	Buyer trading name	_	_	_
cen-163	4	cen	BuyerAddressLine3	textItemType	Buyer address line 3	_	_	_
cen-164	4	cen	TaxRepresentativeAddressLine3	textItemType	Tax representative address line 3	_	_	_
cen-165	4	cen	DeliverToAddressLine3	textItemType	Deliver to address line 3	_	_	_
cenG-16	2	cen	PAYMENT_INSTRUCTIONS	xbrli:stringItemtype	PAYMENT INSTRUCTIONS	_	_	_
cen-82	3	cen	PaymentMeansText	textItemType	Payment means text	_	_	_
cen-83	3	cen	RemittanceInformation	textItemType	Remittance information	_	_	_
cenG-17	3	cen	CREDIT_TRANSFER	xbrli:stringItemtype	CREDIT TRANSFER	_	_	_
cen-84	4	cen	PaymentAccountIdentifier	identifierItemType	Payment account identifier	_	_	_
cen-85	4	cen	PaymentAccountName	textItemType	Payment account name	_	_	_
cen-86	4	cen	PaymentServiceProviderIdentifier	identifierItemType	Payment service provider identifier	_	_	_
cenG-18	3	cen	PAYMENT_CARD_INFORMATION	xbrli:stringItemtype	PAYMENT CARD INFORMATION	_	_	_
cen-87	4	cen	PaymentCardPrimaryAccountNumber	textItemType	Payment card primary account number	_	_	_
cen-88	4	cen	PaymentCardHolderName	textItemType	Payment card holder name	_	_	_
cenG-19	3	cen	DIRECT_DEBIT	xbrli:stringItemtype	DIRECT DEBIT	_	_	_
cen-89	4	cen	MandateReferenceIdentifier	identifierItemType	Mandate reference identifier	_	_	_
cen-90	4	cen	BankAssignedCreditorIdentifier	identifierItemType	Bank assigned creditor identifier	_	_	_
cen-91	4	cen	DebitedAccountIdentifier	identifierItemType	Debited account identifier	_	_	_
cenG-20	2	cen	DOCUMENT_LEVEL_ALLOWANCES	xbrli:stringItemtype	DOCUMENT LEVEL ALLOWANCES	_	_	_
cen-93	3	cen	DocumentLevelAllowanceBaseAmount	amountItemType	Document level allowance base amount	_	_	_
cen-94	3	cen	DocumentLevelAllowancePercentage	percentageItemType	Document level allowance percentage	_	_	_
cen-97	3	cen	DocumentLevelAllowanceReason	textItemType	Document level allowance reason	_	_	_
cen-98	3	cen	DocumentLevelAllowanceReasonCode	codeItemType	Document level allowance reason code	_	_	_
cenG-21	2	cen	DOCUMENT_LEVEL_CHARGES	xbrli:stringItemtype	DOCUMENT LEVEL CHARGES	_	_	_
cen-100	3	cen	DocumentLevelChargeBaseAmount	amountItemType	Document level charge base amount	_	_	_
cen-101	3	cen	DocumentLevelChargePercentage	percentageItemType	Document level charge percentage	_	_	_
cen-104	3	cen	DocumentLevelChargeReason	textItemType	Document level charge reason	_	_	_
cen-105	3	cen	DocumentLevelChargeReasonCode	codeItemType	Document level charge reason code	_	_	_
cenG-22	2	cen	DOCUMENT_TOTALS	xbrli:stringItemtype	DOCUMENT TOTALS	_	_	_
cen-107	3	cen	SumOfAllowancesOnDocumentLevel	amountItemType	Sum of allowances on document level	_	_	_
cen-108	3	cen	SumOfChargesOnDocumentLevel	amountItemType	Sum of charges on document level	_	_	_
cen-109	3	cen	InvoiceTotalAmountWithoutVAT	amountItemType	Invoice total amount without VAT	_	_	_
cen-111	3	cen	InvoiceTotalVATAmountInAccountingCurrency	amountItemType	Invoice total VAT amount in accounting currency	_	_	_
cen-112	3	cen	InvoiceTotalAmountWithVAT	amountItemType	Invoice total amount with VAT	_	_	_
cen-113	3	cen	PaidAmount	amountItemType	Paid amount	_	_	_
cen-114	3	cen	RoundingAmount	amountItemType	Rounding amount	_	_	_
cen-115	3	cen	AmountDueForPayment	amountItemType	Amount due for payment	_	_	_
cenG-23	2	cen	VAT_BREAKDOWN	xbrli:stringItemtype	VAT BREAKDOWN	_	_	_
cen-120	3	cen	VATExemptionReasonText	textItemType	VAT exemption reason text	_	_	_
cen-121	3	cen	VATExemptionReasonCode	codeItemType	VAT exemption reason code	_	_	_
cenG-24	2	cen	ADDITIONAL_SUPPORTING_DOCUMENTS	xbrli:stringItemtype	ADDITIONAL SUPPORTING DOCUMENTS	_	_	_
cen-122	3	cen	SupportingDocumentReference	documentReferenceItemType	Supporting document reference	_	_	_
cen-123	3	cen	SupportingDocumentDescription	textItemType	Supporting document description	_	_	_
cen-124	3	cen	ExternalDocumentLocation	textItemType	External document location	_	_	_
cen-125	3	cen	AttachedDocument	binaryobjectItemType	Attached document	_	_	_
cen-125a	3	cen	AttachedDocumentMimeCode	xbrli:stringItemtype	Attached document Mime code	_	_	_
cen-125b	3	cen	AttachedDocumentFilename	xbrli:stringItemtype	Attached document Filename	_	_	_
cen-8	2	cen	ValueAddedTaxPointDateCode	codeItemType	Value added tax point date code	_	_	_
cen-18	2	cen	InvoicedObjectIdentifier	identifierItemType	Invoiced object identifier	_	_	_
corG-5	2	cor	entryDetail	_	Entry Detail	Parent for entry detail	【仕訳明細】	仕訳明細の親タグ。
cor-21	3	cor	lineNumber	lineNumberItemType	Line Number	Identifier for a particular entry detail\n	明細行番号	仕訳明細の識別子。
cor-22	3	cor	lineNumberCounter	counterItemType	Line Number Counter	Unique reference for the line - a numeric counter	明細行番号カウンタ	明細行の一意なリファレンス　　カウンタ
cenG-26	3	cen	INVOICE_LINE_PERIOD	xbrli:stringItemtype	INVOICE LINE PERIOD	_	_	_
cen-168	4	cen	linePeriodStartDate	dateItemtype	Line Period Start Date	_	_	_
cen-169	4	cen	linePeriodEndDate	dateItemtype	Line Period End Date	_	_	_
corG-6	3	cor	account	_	Account Identifier	Tuple: parent container for account numbers and identifiers. No entry is made here, but each detail line may have multiple accounts assigned to it for reporting in different GAAPs, offsetting accounts in Japan, passing along information to consolidation systems about local versus consolidating accounts, etc. For example, the account 4783HG-QOWI-192837-1000 may be expressed so: \n/account/accountMainID 1000  \n/account/accountMainDescription Cash  \n/account/accountSub/accountSubID 4783HG  \n/account/accountSub/accountSubDescription Department  \n/account/accountSub/accountSubID QOWI  \n/account/accountSub/accountSubDescription Branch  \n/account/accountSub/accountSubID 192837  \n/account/accountSub/accountSubDescription Division	【科目識別子】	タプル。勘定科目番号と識別子の親コンテナ。 ここには記入されないが、個々の明細行は、異なるGAAPでの報告や、日本の見返勘定や、連結勘定科目に対する個別情報の連結会計システムへの伝達などのための、複数の勘定科目を持ちうる。例えば、勘定科目4783HG-QOWI-192837-1000は、次のように表現されうる。\n/account/accountMainID 1000  /account/accountMainDescription Cash  /account/accountSub/accountSubID 4783HG  /account/accountSub/accountSubDescription Department  /account/accountSub/accountSubID QOWI  /account/accountSub/accountSubDescription Branch  /account/accountSub/accountSubID 192837  /account/accountSub/accountSubDescription Division
cor-23	4	cor	accountMainID	accountMainIDItemType	Main Account Number	Main account - the code used to identify the accounting bucket the entry has been assigned to. Examples might be 1000 for Cash, 567GAAZ for Sales Expense or Z for tax payments. Identifiers such as department, branch, division, manager, or other modifiers are noted in the Subaccount area. Before needing to post, account is not necessary. Posting to the general ledger almost always requires an entry here.	主勘定科目コード	主勘定科目。仕訳が関連する会計バケットを特定するためのコード。例えば、現金を表す1000、販売費を表す567GAAZ、税を表すZ。\n部門、支店、事業部、マネージャ、その他の識別子は、Subaccount領域に記述される。転記の必要がなければ、勘定科目は必要ではない。総勘定元帳に転記するにはほとんどの場合必要。
cor-24	4	cor	accountMainDescription	accountMainDescriptionItemType	Main Account Description	Description of accountMainID - the human readable describer that accompanies the code used in accountMainID	主勘定科目説明	主勘定科目コードの説明。主勘定科目コードとして使用されるコードについての、人が読める記述。
cor-25	4	cor	mainAccountType	gl-gen:mainAccountTypeItemType	Account Classification	Account type - FASB Concepts 6 and similar international designs. When xbrlInfo is used to associate other XBRL reporting items, this field is more suited to representing existing systems (audit) than data interchange.	主勘定科目区分	主勘定科目の種別。FASB Concepts 6および、同様の国際的な様式。xbrlInfoが他のXBRL項目と関係付けられる場合、データ交換より現存システム(audit)を示すべき。\n[設定値のリスト]\n(asset：資産)、(liability：負債)、(equity：資本)、(income：収益)、(gain：利得)、(expense：費用)、(loss：損失)、(contr-to-equity：資本増加)、(distr-from-equity：資本減少)、(comprehensive-income：包括利益)、(other：その他) 
cor-26	4	cor	mainAccountTypeDescription	mainAccountTypeDescriptionItemType	Account Classification Description	Free format description of the account classification	主勘定科目区分説明	主勘定科目の区分の説明。
cor-27	4	cor	parentAccountMainID	parentAccountMainIDItemType	Parent Account Number	Roll up item from child natural account to parent natural account.	親勘定科目コード	子勘定科目から親勘定科目に包み込む科目。
cor-28	4	cor	accountPurposeCode	gl-gen:accountPurposeCodeItemType	Purpose of Account	Code related to usage for account aggregate - Consolidating, European, IFRS, Offsetting, Primary, Tax, USGAAP, Japanese, Other. Japanese companies will use this for the tax required offsetting entry. If left blank, assumes default accounting method for company.	勘定科目目的	勘定科目群の使用法を示すコード。連結、European, IFRS, 見返、プライマリ, 税, USGAAP, Japanese,その他。日本企業では、見返仕訳で要求される税務処理に利用するかもしれない。空白の場合、企業の既定の勘定方法とみなす。\n[設定値のリスト]\n(consolidating：連結)、(european：ヨーロッパ)、(ifrs：IFRS)、(offsetting：見返)、(primary：プライマリ)、(tax：税)、(usgaap：US GAAP)、(japanese：日本)、(other：その他)
cor-29	4	cor	accountPurposeDescription	accountPurposeDescriptionItemType	Description of Purpose of Account	Description of usage for aggregate account	勘定科目目的説明	勘定科目群の使用法の説明。
cor-30	4	cor	accountType	gl-gen:accountTypeItemType	Account Type	Type of account	科目種別	科目の種別。\n[設定値のリスト]\n(account：勘定科目)、(bank：銀行)、(employee：従業員)、(customer：顧客)、(job：ジョブ)、(vendor：仕入先)、(measurable：計測可能物)、(statistical：統計)、(other：その他) 
cor-31	4	cor	accountTypeDescription	accountTypeDescriptionItemType	Account Type Description	Free format description of the account type	科目種別説明	科目の種別の説明。
bus-114	4	bus	entryAccountingMethod	accountingMethodItemType	Entry Accounting Method	For this entry, the method of accounting represented - from: accrual, cash, modified cash, modified accrual, encumbrance, special methods, hybrid methods, other	仕訳会計処理方法	この仕訳の会計処理方法を表す。発生基準、現金基準、修正現金基準、修正発生基準、債務基準、特別な方法、混合方法、その他\n[設定値のリスト]\n(accrual：発生基準)、(cash：現金基準)、(modified cash：修正現金基準)、(modified accrual：修正発生基準)、(encumbrance：債務基準)、(special methods：特別な方法)、(hybrid methods：混合方法)、(other：その他)\n
bus-115	4	bus	entryAccountingMethodDescription	entryAccountingMethodDescriptionItemType	Entry Accounting Method Description	Free format description of the entry accounting method	仕訳会計処理方法説明	仕訳の会計処理方法の説明。
bus-116	4	bus	entryAccountingMethodPurpose	accountingMethodPurposeItemType	Entry Accounting Method Purpose	For this entry, the reporting purpose represented - from book, tax, management, statutory, other	仕訳会計処理方法目的	仕訳の報告の目的を表す。帳簿、税、管理、スタチュトリ、その他\n[設定値のリスト]\n(book：帳簿)、(tax：税)、(management：管理)、(statutory：スタチュトリ)、(other：その他)\n
bus-117	4	bus	entryAccountingMethodPurposeDescription	entryAccountingMethodPurposeDescriptionItemType	Entry Accounting Method Purpose Description	Free format description of the entry accounting method purpose	仕訳会計処理方法目的説明	仕訳の会計処理方法の目的の説明。
corG-7	4	cor	accountSub	_	Subaccount Information	Tuple to hold multiple accountSubIDs and Descriptions	【サブ科目情報】	複数のaccountSubIDと説明文を含むタプル。
cor-32	5	cor	accountSubDescription	accountSubDescriptionItemType	Subaccount Description	The description that accompanies accountSubID belongs here.	サブ科目説明	accountSubIDに関する説明。
cor-33	5	cor	accountSubID	accountSubIDItemType	Subaccount	Where the primary account was placed in accountMainID, the code used for each profit center, division, business unit, fund, program, branch, project, class, su-class or other modifier is placed here.	サブ科目コード	主勘定科目をaccountMainIDに指定したときに、各プロフィットセンタ、事業部、事業体、基金、プログラム、支店、プロジェクト、クラス、su-クラス又は他の修飾子に使用されるコードはここに指定する。
cor-34	5	cor	accountSubType	accountSubTypeItemType	Type of Subaccount	Type of sub-account - profit center, division, business unit, fund, program, branch, project, class, su-class or other modifier is placed here. For example:: Accountability center: Business unit: Class:Department: Project: Fund: Program:Job: Profit center: Branch: Setup class: Division: Unit	サブ科目種別	小勘定科目の種別。プロフィットセンタ、事業部、事業体、基金、プログラム、支店、プロジェクト、クラス、su-クラス又は他の修飾子がここに配置される。 例えば、責任単位、事業単位、クラス、部、プロジェクト、基金、プログラム、ジョブ、プロフィットセンター、支店、セットアップクラス、部門、ユニット\n
corG-8	5	cor	segmentParentTuple	_	Segment Parent Information	Tuple for showing the detail necessary to roll up from one segment (type of subaccount) to another.)	【親セグメント情報】	セグメント（小勘定科目の種別）間のロールアップ時に必要な詳細情報を示すタプル。
cor-35	6	cor	parentSubaccountCode	parentSubaccountCodeItemType	Parent Subaccount Code	Subaccount NUMBER this subaccount rolls up to - see also subaccount type it rolls up to.	親サブ科目コード	この小勘定科目のロールアップ先の小勘定科目の番号-ロールアップ先の小勘定科目の種別も参照。
cor-36	6	cor	parentSubaccountType	parentSubaccountTypeItemType	Parent Subaccount Type	The describer of the segment this subaccount rolls up to.	親サブ科目種別	この小勘定科目のロールアップ先のセグメントの説明。
cor-37	6	cor	reportingTreeIdentifier	reportingTreeIdentifierItemType	Reporting Tree Identifier	Used for representing descriptions of reporting trees.	報告系統識別子	報告系統の説明に使用される。
cor-38	6	cor	parentSubaccountProportion	parentSubaccountProportionItemType	Parent Subaccount Percentage	For partial allocations of amounts to different parents, the percentage of a child that will be allocated to a parent.	親サブ科目配分パーセンテージ	異なる親科目に配分する場合に、親科目に割り当てるパーセンテージ。
cor-39	4	cor	accountActive	gl-gen:activeItemType	Account Active	Boolean to indicate whether the account is active (="true") or inactive (="false")	科目有効性	科目が有効か無効かを示すブール値。
cor-40	3	cor	amount	gl-gen:amountItemType	Monetary Amount	This field (amount) represents the primary monetary amount related to the  subject of the entryDetail line. There is one primary monetary amount per entryDetail structure. It may, for example, represent the amount of one line of a journal entry, the balance on a document, or the extended amount of a line item on an invoice. Amount is not required if detailed entry is used for non-financial work and other elements are populated, in particular measurableQuantity. The amount field is a signed number (either positive or negative itself) and used in conjunction with a separate signOfAmount and a separate debitCreditCode, which together are considered for understanding the monetary amount. The unit of measure is determined by amountCurrency if present, and by the default or home currency if amountCurrency is not present.	金額	entryDetailの代表的な金額を示す。entryDetailごとにひとつの値を持つ。たとえば、仕訳帳の行、残高、請求書の行の金額。明細が会計業務用でなく、measurableQuantityなどの他の要素が設定されている場合は不要。符号付数値であり、金額を解釈するために用意されたsignOfAmountおよびdebitCreditCodeとあわせて使用される。通貨単位はamountCurrencyで決定される。amountCurrencyが指定されない場合は、既定または自国の通貨単位となる。
muc-2	3	muc	amountCurrency	currencyItemType	Currency	The currency related to the amount can be entered here instead of the XBRL instance specified way, especially important in multi-currency situations. Recommend ISO 4217 coding.	通貨	XBRLインスタンス内に指定する方法のかわりに、金額の通貨を指定可能。多通貨環境で特に重要。ISO4217コード体系を推奨。
muc-6	3	muc	amountOriginalExchangeRateDate	exchangeRateDateItemType	Original Exchange Rate Date	Date of exchange rate used to record the original transaction.	原取引通貨換算レート日付	原取引の記録に使われた通貨換算レートの日付。
muc-3	3	muc	amountOriginalAmount	gl-gen:amountItemType	Amount in Original Currency	Amount in original (as opposed to home) currency, for multi-currency tracking.	原取引通貨換算額	多通貨取引のための、(自国通貨に対する)原取引通貨での金額。
muc-4	3	muc	amountOriginalCurrency	currencyItemType	Original Currency	The currency used to track original, as opposed to home, amounts. Recommended ISO 4217 coding.	原取引通貨	自国通貨に対する、原取引通貨。ISO4217コードを推奨。
muc-5	3	muc	amountOriginalExchangeRate	exchangeRateItemType	Original Exchange Rate	Exchange rate at time of original transaction (expressed as national currency divided by original currency)	原取引通貨換算レート	原取引時の通貨換算レート。（自国通貨を原取引通貨で割った値）
muc-7	3	muc	amountOriginalExchangeRateSource	exchangeRateSourceItemType	Original Exchange Rate Source	Source of Exchange Rate - for example, Reuters, Bloomberg	原取引通貨換算レート情報源	通貨換算レートの情報源。たとえば、Reuters, Bloomberg。
muc-8	3	muc	amountOriginalExchangeRateComment	commentItemType	Original Exchange Rate Comment	Comment about exchange rate used for recording original transaction.	原取引通貨換算レートコメント	原取引の記録に使用された通貨換算レートに関するコメント。
muc-9	3	muc	amountOriginalTriangulationAmount	gl-gen:amountItemType	Original Amount in Triangulation Currency	If triangulation is used, amount in triangulation currency, for multi-currency tracking. Debit is entered as positive, credit as negative.	原取引トライアンギュレーション通貨換算額	トライアンギュレーション取引の場合に、トライアンギュレーション通貨での金額を指定する。借方は正、貸方は負の値を指定。
muc-10	3	muc	amountOriginalTriangulationCurrency	currencyItemType	Original Triangulation Currency	The currency used for triangulation, if used. May often be EUR or USD. Recommended ISO 4217 coding.	原取引トライアンギュレーション通貨	トライアンギュレーション取引時の通貨。EUR、USDなど。ISO4217コードを推奨。
muc-11	3	muc	amountOriginalTriangulationExchangeRate	exchangeRateItemType	National to Triangulation Currency Exchange Rate	Exchange rate between national currency and triangulation currency at time of original transaction (expressed as national currency divided by triangulation currency)	自国通貨トライアンギュレーション通貨換算レート	原取引時の、自国通貨とトライアンギュレーション通貨との換算レート。（自国通貨をトライアンギュレーション通貨で割った値）
muc-12	3	muc	amountOriginalTriangulationExchangeRateSource	exchangeRateSourceItemType	National to Triangulation Currency Exchange Rate Source	Source of Exchange Rate for triangulation amount at time of original transaction - for example, Reuters, Bloomberg	自国通貨トライアンギュレーション通貨換算レート情報源	原取引時の、トライアンギュレーション取引金額の換算レートの情報源。たとえば、Reuters, Bloomberg。
muc-13	3	muc	amountOriginalTriangulationExchangeRateType	exchangeRateTypeItemType	National to Triangulation Currency Exchange Rate Type	Type of Exchange Rate for triangulation amount at time of original transaction - for example, spot rate, forward contract etc.	自国通貨トライアンギュレーション通貨換算レート種別	原取引時の、トライアンギュレーション取引金額の換算レートの種別。たとえば、スポット・レート、先物など。
muc-14	3	muc	originalTriangulationExchangeRate	exchangeRateItemType	Original to Triangulation Currency Exchange Rate	Exchange rate between original currency and triangulation currency at time of original transaction (expressed as original currency divided by triangulation currency)	原取引通貨トライアンギュレーション通貨換算レート	原取引時の、原取引通貨とトライアンギュレーション通貨との換算レート。（原取引通貨をトライアンギュレーション通貨で割った値）
muc-15	3	muc	originalExchangeRateTriangulationSource	exchangeRateSourceItemType	Original to Triangulation Currency Exchange Rate Source	Source of Exchange Rate for triangulation from original currency to triangulation currency at time of original transaction - for example, Reuters, Bloomberg	原取引通貨トライアンギュレーション通貨換算レート情報源	原取引時の、原取引通貨からトライアンギュレーション通貨への換算レートの情報源。たとえば、Reuters, Bloomberg。
muc-16	3	muc	originalExchangeRateTriangulationType	exchangeRateTypeItemType	Original to Triangulation Currency Exchange Rate Type	Type of Exchange Rate for triangulation from original currency to triangulation currency at time of original transaction - for example, spot rate, forward contract etc.	原取引通貨トライアンギュレーション通貨換算レート種別	原取引時の、原取引通貨からトライアンギュレーション通貨への換算レートの種別。たとえば、スポット・レート、先物など。
cor-41	3	cor	signOfAmount	gl-gen:signOfAmountItemType	Sign Indication for Amount	Sign of amount; provides 4 possible fields only when used in conjunction with debitCreditCode; primarily used for correcting entries so total debits and credits after an entry error are not inflated. D + increase DebitsD - decrease debitsC + decreases creditC - increases credit	金額符号	金額の符号。貸借識別子と関連して使用される場合にだけ、4つの可能なフィールドを提供する。記入エラー後の総貸借が膨張しないように、おもに仕訳の訂正に使用される。 D+は借方を増加させる。D-は借方を減少させる。C+は貸方を減少させる。C-は貸方を増加させる。\n[設定値のリスト]\n(+)、(-)、(plus：プラス)、(minus：マイナス) 
cor-42	3	cor	debitCreditCode	gl-gen:debitCreditCodeItemType	Debit/Credit Identifier	Optional identifier of whether the amount is a (D)ebit, a (C)redit or Undefined	貸借区分コード	金額が借方か貸方か不定かを示す識別子。\n[設定値のリスト]\n(D)、(C)、(debit：借方)、(credit：貸方)、(undefined：不定) 
