code	0	level	module	term	type	label	description	label-ja
corG-1	1	1	cor	accountingEntries	_	Accounting Entries	Root for XBRL GL. No entry made here.	【会計仕訳】
corG-2	2	2	cor	documentInfo	_	Document Information	Parent for descriptive information about the accountingEntries section in which it is contained.	【文書情報】
cor-1	3	3	cor	entriesType	gl-gen:entriesTypeItemType	Document Type	account: information to fill in a chart of accounts file. \nbalance: the results of accumulation of a complete and validated list of entries for an account (or a list of account) in a specific period - sometimes called general ledger \nentries:  a list of individual accounting entries, which might be posted/validated or nonposted/validated  \njournal: a self-balancing (Dr = Cr) list of entries for a specific period including beginning balance for that period.  \nledger: a complete list of entries for a specific account (or list of accounts) for a specific period; note - debits do not have to equal credits.   \nassets: a listing of open receivables, payables, inventory, fixed assets or other information that can be extracted from but are not necessarily included as part of a journal entry.  \ntrialBalance: the self-balancing (Dr = Cr) result of accumulation of a complete and validated list of entries for the entity in a complete list of accounts in a specific period. \ntaxtables:  aids automated interpretation of instances that represent tax tables; Tax table are defined by using multiple [taxes] structures to gather the population of codes, authorities and rates; through [taxTableCode] cross-references in the [taxes] structure, these "master file" tax tables can be referenced. \nOften sorted by date or by account, these terms have specific, and sometimes different, meanings in different areas. Common practice will drive accounting method/term matches.	文書種別
cor-2	4	3	cor	uniqueID	uniqueIDItemType	Audit Number	Unique identifier for this file.	監査番号
cor-3	5	3	cor	revisesUniqueID	revisesUniqueIDItemType	Revises Audit Number\n	If this batch of information revises a previous batch of information, this field identifies the previous batch that is being revised. 'uniqueID' of the previous batch goes here. Developers should consider exception reporting.	改訂前監査番号
cor-4	6	3	cor	revisesUniqueIDAction	gl-gen:revisesUniqueIDActionItemType	Action to Take with Previous Data	Provides guidance on action to take with previous set of data: supersedes - old data should be considered as obsolete/overwritten; supplements - belongs with that data as if it was included with it.	改訂前データ処置
cor-5	7	3	cor	language	languageItemType	Language	Primary language of the intellectual content. Where practical, the content of this field should coincide with ISO 639-1988 language codes.	言語
cor-6	8	3	cor	creationDate	creationDateItemType	Creation Date	Date/time file was created.	作成日付
bus-1	9	3	bus	creator	creatorItemType	Creator	Identifies the creator of the XBRL instance.	作成者
cor-7	10	3	cor	entriesComment	entriesCommentItemType	Document Comment	Text for entire document.	文書コメント
cor-8	11	3	cor	periodCoveredStart	periodCoveredStartItemType	Period Covered Start	Start of date range for contents. Used as basis for many assumptions about data, including the date as of which open balances are open.	対象期間開始日付
cor-9	12	3	cor	periodCoveredEnd	periodCoveredEndItemType	Period Covered End	End of date range for contents. Used as basis for many assumptions about data, including the date as of which open balances are open.	対象期間終了日付
bus-2	13	3	bus	periodCount	periodCountItemType	Period Count	Number of periods or buckets, used by postingCode. Used to interpret posting date. It may be preferable to limit entries by period covered to be by individual reporting period.	期間数
bus-3	14	3	bus	periodUnit	periodUnitTypeItemType	Period Unit	Type of periods covered by periodCount	期間単位
bus-4	15	3	bus	periodUnitDescription	periodUnitDescriptionItemType	Period Unit Description	Free format description of the period unit	期間単位説明
bus-5	16	3	bus	sourceApplication	sourceApplicationItemType	Source Application	Product or service that produced this file. Used by many systems (e.g., VAT). Version number can be included or extended.	作成元アプリケーション
bus-6	17	3	bus	targetApplication	targetApplicationItemType	Target Application	Particular use for which file was generated.	対象アプリケーション
muc-1	18	3	muc	defaultCurrency	currencyItemType	Default Currency	The default currency related to the amount can be entered here instead of the XBRL instance specified way, especially important in multi-currency situations. Recommend ISO 4217 coding	既定通貨
srcdG-1	19	3	srcd	summaryReportingTaxonomies	_	Summary Reporting Taxonomies	Identifies and provides information about one or more target reporting taxonomies to which the data represented in the document rolls up to.	【集約報告タクソノミ】
srcd-1	20	4	srcd	summaryReportingTaxonomyID	summaryReportingTaxonomyIDItemType	Summary Reporting Taxonomy ID	Identifies a target reporting taxonomy so that, for example, it can be referenced in the [summaryReportingTaxonomyIDRef] data field at [xbrlInfo] level.	集約報告タクソノミ識別子
srcd-2	21	4	srcd	summaryReportingTaxonomySchemaRefHref	summaryReportingTaxonomySchemaRefHrefItemType	Summary Reporting Taxonomy Schema Reference Href Attribute	Value of the href attribute of schemaRef in the target reporting taxonomy.	集約報告タクソノミスキーマ参照情報
srcd-3	22	4	srcd	summaryReportingTaxonomyHeader	summaryReportingTaxonomyHeaderItemType	Summary Reporting Taxonomy Header	An all-purpose data field where all the information necessary when it is too complex to be defined otherwise.	集約報告タクソノミヘッダ
srcd-4	23	4	srcd	summaryReportingTaxonomyDescription	summaryReportingTaxonomyDescriptionItemType	Summary Reporting Taxonomy Description	A description of the taxonomy for human use.	集約報告タクソノミ説明
cenG-16	24	3	cen	PAYMENT_INSTRUCTIONS	_	PAYMENT INSTRUCTIONS	A group of business terms providing information about the payment.	_
cen-82	25	4	cen	PaymentMeansText	textItemType	Payment means text	The means, expressed as text, for how a payment is expected to be or has been settled.	_
cen-83	26	4	cen	RemittanceInformation	textItemType	Remittance information	A textual value used to establish a link between the payment and the Invoice, issued by the Seller.	_
cenG-17	27	4	cen	CREDIT_TRANSFER	_	CREDIT TRANSFER	A group of business terms to specify credit transfer payments.	_
cen-84	28	5	cen	PaymentAccountIdentifier	identifierItemType	Payment account identifier	A unique identifier of the financial payment account, at a payment service provider, to which payment should be made.	_
cen-85	29	5	cen	PaymentAccountName	textItemType	Payment account name	The name of the payment account, at a payment service provider, to which payment should be made.	_
cen-86	30	5	cen	PaymentServiceProviderIdentifier	identifierItemType	Payment service provider identifier	An identifier for the payment service provider where a payment account is located.	_
cenG-18	31	4	cen	PAYMENT_CARD_INFORMATION	_	PAYMENT CARD INFORMATION	A group of business terms providing information about card used for payment contemporaneous with invoice issuance.	_
cen-87	32	5	cen	PaymentCardPrimaryAccountNumber	textItemType	Payment card primary account number	The Primary Account Number (PAN) of the card used for payment.	_
cen-88	33	5	cen	PaymentCardHolderName	textItemType	Payment card holder name	The name of the payment card holder.	_
cenG-19	34	4	cen	DIRECT_DEBIT	_	DIRECT DEBIT	A group of business terms to specify a direct debit.	_
cen-89	35	5	cen	MandateReferenceIdentifier	identifierItemType	Mandate reference identifier	Unique identifier assigned by the Payee for referencing the direct debit mandate.	_
cen-90	36	5	cen	BankAssignedCreditorIdentifier	identifierItemType	Bank assigned creditor identifier	Unique banking reference identifier of the Payee or Seller assigned by the Payee or Seller bank.	_
cen-91	37	5	cen	DebitedAccountIdentifier	identifierItemType	Debited account identifier	The account to be debited by the direct debit.	_
cenG-3	38	3	cen	PRECEDING_INVOICE_REFERENCE	_	PRECEDING INVOICE REFERENCE	A group of business terms providing information on one or more preceding Invoices.	_
cenG-1	39	3	cen	INVOICE_NOTE	_	INVOICE NOTE	A group of business terms providing textual notes that are relevant for the invoice, together with an indication of the note subject.	_
cen-21	40	4	cen	InvoiceNoteSubjectCode	codeItemType	Invoice note subject code	The subject of the textual note in BT-22.	_
cen-1	41	4	cen	InvoiceNote	textItemType	Invoice note	A group of business terms providing textual notes that are relevant for the invoice, together with an indication of the note subject.	_
cenG-2	42	3	cen	PROCESS_CONTROL	_	PROCESS CONTROL	A group of business terms providing information on the business process and rules applicable to the Invoice document.	_
cen-23	43	4	cen	BusinessProcessType	textItemType	Business process type	Identifies the business process context in which the transaction appears, to enable the Buyer to process the Invoice in an appropriate way.	_
cen-24	44	4	cen	SpecificationIdentifier	identifierItemType	Specification identifier	An identification of the specification containing the total set of rules regarding semantic content, cardinalities and business rules to which the data contained in the instance document conforms.	_
corG-3	45	2	cor	entityInformation	_	Entity Information section	Holder for entity information - information about the reporting organization.	【事業体情報】
busG-1	46	3	bus	entityPhoneNumber	_	Entity Phone Number	Primary phone number of the entity.	【事業体電話番号】
bus-7	47	4	bus	phoneNumberDescription	gl-gen:phoneNumberDescriptionItemType	Entity Phone Number Description	Entity Phone Number Description such as Main, Investor relations.	事業体電話番号説明
bus-8	48	4	bus	phoneNumber	gl-gen:phoneNumberItemType	Entity Phone Number	Phone number referred to in 'phoneNumberDescription'	事業体電話番号
busG-2	49	3	bus	entityFaxNumberStructure	_	Entity Fax Number Structure	Tuple for holding company fax information.	【事業体FAX番号】
bus-9	50	4	bus	entityFaxNumberUsage	gl-gen:faxNumberUsageItemType	Entity Fax Number Usage	Company fax number usage (e.g. orders, head office, IR)	事業体FAX番号用途
bus-10	51	4	bus	entityFaxNumber	gl-gen:faxNumberItemType	Entity Fax Number	Company Fax Number	事業体FAX番号
busG-3	52	3	bus	entityEmailAddressStructure	_	Entity Email Address Structure	Tuple for holding company email information.	【事業体Eメールアドレス】
bus-11	53	4	bus	entityEmailAddressUsage	gl-gen:emailAddressUsageItemType	Entity Email Address Usage	Company email address usage (e.g. orders, head office, IR)	事業体Eメールアドレス用途
bus-12	54	4	bus	entityEmailAddress	gl-gen:emailAddressItemType	Entity Email Address	Company Email Address	事業体Eメールアドレス
bus-13	55	3	bus	organizationAccountingMethodPurposeDefault	accountingMethodPurposeItemType	Default Accounting Method Purpose	If not stated explicitly at the line level, the default reporting purpose - from book, tax, management, statutory, other	既定会計処理方法目的
bus-14	56	3	bus	organizationAccountingMethodPurposeDefaultDescription	organizationAccountingMethodPurposeDefaultDescriptionItemType	Default Accounting Method Purpose Description	Free format description of the default accounting method purpose	既定会計処理方法目的説明
busG-4	57	3	bus	organizationIdentifiers	_	Identifiers	Section which contains various identifiers for the company.	【識別子】
bus-15	58	4	bus	organizationIdentifier	organizationIdentifierItemType	Organization Identifier	Code representing the company or organization whose data this file represents: used for situations where one user (e.g., a CPA) needs to keep track of multiple organizations' files (e.g., multiple clients). Can be EIN#, client #, internal/external identifier, SIC code. Codes which identifies the entity. Includes the code identifier of the authority issuing the code, a colon, and the code itself. For example, CIK:01234567 for the CIK number issued by SEC EDGAR.	事業体識別子
bus-16	59	4	bus	organizationDescription	organizationDescriptionItemType	Organization Description	Text for organization identified by organizationIdentifier. Any descriptive information about the code.	事業体説明
busG-5	60	3	bus	organizationAddress	_	Address	Address structure for the reporting entity	【住所】
bus-17	61	4	bus	organizationAddressName	organizationAddressNameItemType	Address Name	Name of organization used at this address	住所名
bus-18	62	4	bus	organizationAddressDescription	organizationAddressDescriptionItemType	Address Description	Description of the address, such as Mailing, Physical, Investor Relations, etc.	住所説明
bus-19	63	4	bus	organizationAddressPurpose	organizationAddressPurposeItemType	Address Purpose	Freeform for codes like shipping, billing, mailing at address level.  Allows identification of multiple purpose addresses for each identifier.	住所目的
bus-20	64	4	bus	organizationAddressLocationIdentifier	locationIdentifierItemType	Location Identifier	A code used to identify the location and to associate it with contacts and transactions	所在地識別子
bus-21	65	4	bus	organizationBuildingNumber	organizationBuildingNumberItemType	Building Number	Building Number	建物番号
bus-22	66	4	bus	organizationAddressStreet	organizationAddressStreetItemType	Street	Street address	通り
bus-23	67	4	bus	organizationAddressStreet2	organizationAddressStreet2ItemType	Address Detail	Address Detail	住所詳細
cen-34	68	4	cen	organizationAddressStreet3	textItemType	Address Further Detail	An additional address line in an address that can be used to give further details supplementing the main line.	
bus-24	69	4	bus	organizationAddressCity	organizationAddressCityItemType	City	City or town of the address.	都市
bus-25	70	4	bus	organizationAddressStateOrProvince	organizationAddressStateOrProvinceItemType	State or Province	State, province or region of the address.	州
bus-26	71	4	bus	organizationAddressZipOrPostalCode	organizationAddressZipOrPostalCodeItemType	Zip or Postal Code	Zip or other postal code of the address.	郵便番号
bus-27	72	4	bus	organizationAddressCountry	organizationAddressCountryItemType	Country	Country of the address.	国
bus-28	73	4	bus	organizationAddressActive	gl-gen:activeItemType	Address Active	Boolean to indicate whether the address is active (="true") or inactive (="false")	住所有効性
busG-6	74	3	bus	entityWebSite	_	Entity Web Site	Primary web site of the entity.	【事業体Webサイト】
bus-29	75	4	bus	webSiteDescription	webSiteDescriptionItemType	Web Site Description	Description of the web site.	Webサイト説明
bus-30	76	4	bus	webSiteURL	webSiteURLItemType	Web Site URL	Valid URL of the web site. Should be full URL.	WebサイトURL
busG-7	77	3	bus	contactInformation	_	Contact Information	Information about contacts.	【担当者情報】
bus-31	78	4	bus	contactPrefix	contactPrefixItemType	Prefix	Prefix (e.g. Dr., Mr., Mrs.)	敬称
bus-32	79	4	bus	contactLastName	contactLastNameItemType	Last Name	Last or family name	姓
bus-33	80	4	bus	contactFirstName	contactFirstNameItemType	First Name	First or given name	名
bus-34	81	4	bus	contactSuffix	contactSuffixItemType	Suffix	Suffix (e.g. MD, CPA, Jr.)	付加名称
bus-35	82	4	bus	contactAttentionLine	contactAttentionLineItemType	Attention Line	Attention Line	アテンションライン
bus-36	83	4	bus	contactPositionRole	contactPositionRoleItemType	Position/Role	Position or role	地位/役職
busG-8	84	4	bus	contactPhone	_	Contact Phone Number	Contact Phone Number	【担当者電話番号】
bus-37	85	5	bus	contactPhoneNumberDescription	gl-gen:phoneNumberDescriptionItemType	Contact Phone Number Description	Contact Phone Number Description such as Main, Investor relations, etc.	担当者電話番号説明
bus-38	86	5	bus	contactPhoneNumber	gl-gen:phoneNumberItemType	Contact Phone Number	Contact phone number referred to in the description.	担当者電話番号
busG-9	87	4	bus	contactFax	_	Contact Fax Number Structure	Contact Fax Number Structure	【担当者FAX番号】
bus-39	88	5	bus	contactFaxNumberUsage	gl-gen:faxNumberUsageItemType	Contact Fax Number Usage	Contact Fax Number Usage (e.g. orders, head office, IR)	担当者FAX番号用途
bus-40	89	5	bus	contactFaxNumber	gl-gen:faxNumberItemType	Contact Fax Number	Contact Fax Number	担当者FAX番号
busG-10	90	4	bus	contactEMail	_	Contact Email Address Structure	Contact E-mail address structure	【担当者Eメールアドレス】
bus-41	91	5	bus	contactEmailAddressUsage	gl-gen:emailAddressUsageItemType	Contact Email Address Usage	Contact email address usage (e.g. orders, head office, IR)	担当者Eメールアドレス用途
bus-42	92	5	bus	contactEmailAddress	gl-gen:emailAddressItemType	Contact Email Address	Contact email address	担当者Eメールアドレス
bus-43	93	4	bus	contactType	contactTypeItemType	Role of Contact	Role of contact. Examples include: Source Service, Sender, Recipient, Invoicer, Auditor, Accountant	担当者役割
bus-44	94	4	bus	contactLocationIdentifierCrossReference	locationIdentifierItemType	Location ID cross reference	This code is used to associate the contact with a specific location for the Entity. Its value should be the same as that of the organizationAddressLocationIdentifier	所在地相互参照情報
bus-45	95	4	bus	contactActive	gl-gen:activeItemType	Contact Active	Boolean to indicate whether the contact is active (="true") or inactive (="false")	担当者有効性
bus-46	96	3	bus	businessDescription	businessDescriptionItemType	Business Description	Description of the nature of the business of the entity.	業種説明
bus-47	97	3	bus	fiscalYearStart	fiscalYearStartItemType	Fiscal Year Start	Start of fiscal year. Where appropriate, corporate year period representation permits non-365 or 366 day years (more appropriate for internal sharing than data from external sources), In Europe, some jurisdictions allow 2 year minus 1 day fiscal years.	会計年度開始日付
bus-48	98	3	bus	fiscalYearEnd	fiscalYearEndItemType	Fiscal Year End	End of fiscal year. Where appropriate, corporate year period representation permits non-365 or 366 day years (more appropriate for internal sharing than data from external sources), In Europe, some jurisdictions allow 2 year minus 1 day fiscal years.	会計年度終了日付
busG-11	99	3	bus	organizationAccountingMethodStructure	_	Accounting Method Structure	Section for identifying the methods of accounting used by the entity for different reporting purposes	【会計処理方法】
bus-49	100	4	bus	organizationAccountingMethod	accountingMethodItemType	Accounting Method	For this entity, the method of accounting represented - from: accrual, cash, modified cash, modified accrual, encumbrance, special methods, hybrid methods, other	会計処理方法
bus-50	101	4	bus	organizationAccountingMethodDescription	organizationAccountingMethodDescriptionItemType	Accounting Method Description	Free format description of the accounting method	会計処理方法説明
bus-51	102	4	bus	organizationAccountingMethodPurpose	accountingMethodPurposeItemType	Accounting Method Purpose	For this entity, the reporting purpose represented - from book, tax, management, statutory, other	会計処理方法目的
bus-52	103	4	bus	organizationAccountingMethodPurposeDescription	organizationAccountingMethodPurposeDescriptionItemType	Accounting Method Purpose Description	Free format description of the accounting method purpose	会計処理方法目的説明
bus-53	104	4	bus	organizationAccountingMethodStartDate	organizationAccountingMethodStartDateItemType	Accounting Method Start Date	Accounting Method Start Date	会計処理方法開始日付
bus-54	105	4	bus	organizationAccountingMethodEndDate	organizationAccountingMethodEndDateItemType	Accounting Method End Date	Accounting Method End Date	会計処理方法終了日付
busG-12	106	3	bus	accountantInformation	_	Accountant Information	Information about the relevant external accountant	【会計士情報】
bus-55	107	4	bus	accountantName	accountantNameItemType	Accountant Name	Name of the accountant	会計士名
busG-13	108	4	bus	accountantAddress	_	Accountant Address	Section which contains accountant address information.	【会計士住所】
bus-56	109	5	bus	accountantAddressName	accountantAddressNameItemType	Address Name	Address Name for Accountant	会計士住所名
bus-57	110	5	bus	accountantAddressDescription	accountantAddressDescriptionItemType	Address Description	Address Description for Accountant	会計士住所説明
bus-58	111	5	bus	accountantAddressPurpose	accountantAddressPurposeItemType	Address Purpose	Address Purpose	会計士住所目的
bus-59	112	5	bus	accountantAddressLocationIdentifier	locationIdentifierItemType	Accountant Location Identifier	A code used to identify the accountant location and to associate it with contacts and transactions	会計士所在地識別子
bus-60	113	5	bus	accountantBuildingNumber	accountantBuildingNumberItemType	Building Number	Building Number for Accountant	会計士住所建物番号
bus-61	114	5	bus	accountantStreet	accountantStreetItemType	Street	Street address of the accountant	会計士住所通り
bus-62	115	5	bus	accountantAddressStreet2	accountantAddressStreet2ItemType	Address Detail	Address Detail for Accountant	会計士住所詳細
bus-63	116	5	bus	accountantCity	accountantCityItemType	City	City of the accountant	会計士住所都市
bus-64	117	5	bus	accountantStateOrProvince	accountantStateOrProvinceItemType	State or Province	State, province or region of the accountant	会計士住所州
bus-65	118	5	bus	accountantCountry	accountantCountryItemType	Country	Country of accountant	会計士住所国
bus-66	119	5	bus	accountantZipOrPostalCode	accountantZipOrPostalCodeItemType	Zip or Postal Code	Zip or other postal code of the accountant	会計士住所郵便番号
bus-67	120	5	bus	accountantAddressActive	gl-gen:activeItemType	Accountant Address Active	Boolean to indicate whether the address is active (="true") or inactive (="false")	会計士住所有効性
bus-68	121	4	bus	accountantEngagementType	accountantEngagementTypeItemType	Type of Engagement	Type of engagement being performed by external accountant	契約種別
bus-69	122	4	bus	accountantEngagementTypeDescription	accountantEngagementTypeDescriptionItemType	Type of Engagement Description	Free format description of the type of engagement	契約種別説明
busG-14	123	4	bus	accountantContactInformation	_	Accountant Contact Information	Accountant Contact Information Structure	【会計士担当者情報】
bus-70	124	5	bus	accountantContactPrefix	accountantContactPrefixItemType	Prefix	Prefix (e.g. Dr., Mr., Mrs., etc.) for Accountant Contact	会計士担当者敬称
bus-71	125	5	bus	accountantContactLastName	accountantContactLastNameItemType	Last Name	Family Name for Accountant Contact	会計士担当者姓
bus-72	126	5	bus	accountantContactFirstName	accountantContactFirstNameItemType	First  Name	First or Given Name for Accountant Contact	会計士担当者名
bus-73	127	5	bus	accountantContactSuffix	accountantContactSuffixItemType	Suffix	Suffix (e.g. MD, CPA, Jr., etc.)	会計士担当者付加名称
bus-74	128	5	bus	accountantContactAttentionLine	accountantContactAttentionLineType	Attention Line	Attention Line for Accountant Contact	会計士担当者アテンションライン
bus-75	129	5	bus	accountantContactPositionRole	accountantContactPositionRoleItemType	Position/Role	Position or Role for Accountant Contact	会計士担当者地位/役職
busG-15	130	5	bus	accountantContactPhone	_	Contact Phone	Phone Number for Accountant Contact	【会計士担当者電話番号】
bus-76	131	6	bus	accountantContactPhoneNumberDescription	gl-gen:phoneNumberDescriptionItemType	Accountant Contact Phone Number Description	Accountant Contact Phone Number Description such as Main, Investor relations, etc.	会計士担当者電話番号説明
bus-77	132	6	bus	accountantContactPhoneNumber	gl-gen:phoneNumberItemType	Accountant Contact Phone Number	Accountant Contact phone number referred to in the description.	会計士担当者電話番号
busG-16	133	5	bus	accountantContactFax	_	Contact Fax Number Structure	Accountant Contact Fax Number Structure	【会計士担当者FAX番号】
bus-78	134	6	bus	accountantContactFaxNumber	gl-gen:faxNumberItemType	Accountant Contact Fax Number	Accountant Contact Fax Number	会計士担当者FAX番号
bus-79	135	6	bus	accountantContactFaxNumberUsage	gl-gen:faxNumberUsageItemType	Accountant Contact Fax Number Usage	Accountant Contact Fax Number Usage (e.g. orders, head office, IR)	会計士担当者FAX番号用途
busG-17	136	5	bus	accountantContactEmail	_	Contact Email Address Structure	Accountant contact E-mail address structure	【会計士担当者Eメールアドレス】
bus-80	137	6	bus	accountantContactEmailAddressUsage	gl-gen:emailAddressUsageItemType	Accountant Contact Email Address Usage	Accountant Contact email address usage (e.g. orders, head office, IR)	会計士担当者Eメールアドレス用途
bus-81	138	6	bus	accountantContactEmailAddress	gl-gen:emailAddressItemType	Accountant Contact Email Address	Accountant Contact email address	会計士担当者Eメールアドレス
bus-82	139	5	bus	accountantContactType	accountantContactTypeItemType	Accountant Contact Type	Contact Type for Accountant Contact	会計士担当者役割
