code	seq	level	module	term	type	label	description	label-ja	description-ja
usk-6	170	3	usk	nextDateRepeat	nextDateRepeatItemType	Next Date Repeat	Date next repeated or standard posted	次回反復日付	次回の反復あるいは通常の転記日。
usk-7	171	3	usk	lastDateRepeat	lastDateRepeatItemType	Last Date Repeat	Date last repeated or standard posted	前回反復日付	前回の反復あるいは通常の転記日。
usk-8	172	3	usk	endDateRepeatingEntry	endDateRepeatingEntryItemType	End Date of Repeating Entry	For standard or recurring journals, stop date/time for repetitive entry.	反復仕訳終了日付	通常仕訳または反復仕訳のための、反復入力の終了日付/時刻。
usk-9	173	3	usk	reverse	reverseTypeItemType	Reverse	Should entry be reversed?	反対仕訳要否	仕訳が取り消されるべきか。
usk-10	174	3	usk	reversingDate	reversingDateItemType	Reversing Date	Date this entry should be reversed	反対仕訳日付	この仕訳が取り消されるべき日付。
cor-20	175	3	cor	entryNumberCounter	counterItemType	Entry Number Counter	Unique reference for the entry - a numeric counter	仕訳番号カウンタ	仕訳の一意なリファレンス　　カウンタ
cenG-1	176	3	cen	INVOICE_NOTE	_	INVOICE NOTE	A group of business terms providing textual notes that are relevant for the invoice, together with an indication of the note subject.	_	_
cen-21	177	4	cen	InvoiceNoteSubjectCode	codeItemType	Invoice note subject code	The subject of the textual note in BT-22.	_	_
cen-1	178	4	cen	InvoiceNote	textItemType	Invoice note	A group of business terms providing textual notes that are relevant for the invoice, together with an indication of the note subject.	_	_
cenG-2	179	3	cen	PROCESS_CONTROL	_	PROCESS CONTROL	A group of business terms providing information on the business process and rules applicable to the Invoice document.	_	_
cen-23	180	4	cen	BusinessProcessType	textItemType	Business process type	Identifies the business process context in which the transaction appears, to enable the Buyer to process the Invoice in an appropriate way.	_	_
cen-24	181	4	cen	SpecificationIdentifier	identifierItemType	Specification identifier	An identification of the specification containing the total set of rules regarding semantic content, cardinalities and business rules to which the data contained in the instance document conforms.	_	_
cenG-3	182	3	cen	PRECEDING_INVOICE_REFERENCE	_	PRECEDING INVOICE REFERENCE	A group of business terms providing information on one or more preceding Invoices.	_	_
cen-28	183	4	cen	SellerTradingName	textItemType	Seller trading name	A name by which the Seller is known, other than Seller name (also known as Business name].	_	_
cen-33	184	4	cen	SellerAdditionalLegalInformation	textItemType	Seller additional legal information	Additional legal information relevant for the Seller.	_	_
cen-162	185	5	cen	SellerAddressLine3	textItemType	Seller address line 3	An additional address line in an address that can be used to give further details supplementing the main line.	_	_
cen-45	186	5	cen	BuyerTradingName	textItemType	Buyer trading name	A name by which the Buyer is known, other than Buyer name (also known as Business name).	_	_
cen-163	187	5	cen	BuyerAddressLine3	textItemType	Buyer address line 3	An additional address line in an address that can be used to give further details supplementing the main line.	_	_
cen-164	188	5	cen	TaxRepresentativeAddressLine3	textItemType	Tax representative address line 3	An additional address line in an address that can be used to give further details supplementing the main line.	_	_
cen-165	189	5	cen	DeliverToAddressLine3	textItemType	Deliver to address line 3	An additional address line in an address that can be used to give further details supplementing the main line.	_	_
cenG-16	190	3	cen	PAYMENT_INSTRUCTIONS	_	PAYMENT INSTRUCTIONS	A group of business terms providing information about the payment.	_	_
cen-82	191	4	cen	PaymentMeansText	textItemType	Payment means text	The means, expressed as text, for how a payment is expected to be or has been settled.	_	_
cen-83	192	4	cen	RemittanceInformation	textItemType	Remittance information	A textual value used to establish a link between the payment and the Invoice, issued by the Seller.	_	_
cenG-17	193	4	cen	CREDIT_TRANSFER	_	CREDIT TRANSFER	A group of business terms to specify credit transfer payments.	_	_
cen-84	194	5	cen	PaymentAccountIdentifier	identifierItemType	Payment account identifier	A unique identifier of the financial payment account, at a payment service provider, to which payment should be made.	_	_
cen-85	195	5	cen	PaymentAccountName	textItemType	Payment account name	The name of the payment account, at a payment service provider, to which payment should be made.	_	_
cen-86	196	5	cen	PaymentServiceProviderIdentifier	identifierItemType	Payment service provider identifier	An identifier for the payment service provider where a payment account is located.	_	_
cenG-18	197	4	cen	PAYMENT_CARD_INFORMATION	_	PAYMENT CARD INFORMATION	A group of business terms providing information about card used for payment contemporaneous with invoice issuance.	_	_
cen-87	198	5	cen	PaymentCardPrimaryAccountNumber	textItemType	Payment card primary account number	The Primary Account Number (PAN) of the card used for payment.	_	_
cen-88	199	5	cen	PaymentCardHolderName	textItemType	Payment card holder name	The name of the payment card holder.	_	_
cenG-19	200	4	cen	DIRECT_DEBIT	_	DIRECT DEBIT	A group of business terms to specify a direct debit.	_	_
cen-89	201	5	cen	MandateReferenceIdentifier	identifierItemType	Mandate reference identifier	Unique identifier assigned by the Payee for referencing the direct debit mandate.	_	_
cen-90	202	5	cen	BankAssignedCreditorIdentifier	identifierItemType	Bank assigned creditor identifier	Unique banking reference identifier of the Payee or Seller assigned by the Payee or Seller bank. 	_	_
cen-91	203	5	cen	DebitedAccountIdentifier	identifierItemType	Debited account identifier	The account to be debited by the direct debit.	_	_
cenG-20	204	3	cen	DOCUMENT_LEVEL_ALLOWANCES	_	DOCUMENT LEVEL ALLOWANCES	A group of business terms providing information about allowances applicable to the Invoice as a whole.	_	_
cen-93	205	4	cen	DocumentLevelAllowanceBaseAmount	amountItemType	Document level allowance base amount	The base amount that may be used, in conjunction with the document level allowance percentage, to calculate the document level allowance amount.	_	_
cen-94	206	4	cen	DocumentLevelAllowancePercentage	percentageItemType	Document level allowance percentage	The percentage that may be used, in conjunction with the document level allowance base amount, to calculate the document level allowance amount.	_	_
cen-97	207	4	cen	DocumentLevelAllowanceReason	textItemType	Document level allowance reason	The reason for the document level allowance, expressed as text	_	_
cen-98	208	4	cen	DocumentLevelAllowanceReasonCode	codeItemType	Document level allowance reason code	The reason for the document level allowance, expressed as a code.	_	_
cenG-21	209	3	cen	DOCUMENT_LEVEL_CHARGES	_	DOCUMENT LEVEL CHARGES	A group of business terms providing information about charges and taxes other than VAT, applicable to the Invoice as a whole.	_	_
cen-100	210	4	cen	DocumentLevelChargeBaseAmount	amountItemType	Document level charge base amount	The base amount that may be used, in conjunction with the document level charge percentage, to calculate the document level charge amount.	_	_
cen-101	211	4	cen	DocumentLevelChargePercentage	percentageItemType	Document level charge percentage	The percentage that may be used, in conjunction with the document level charge base amount, to calculate the document level charge amount	_	_
cen-104	212	4	cen	DocumentLevelChargeReason	textItemType	Document level charge reason	The reason for the document level charge, expressed as text.	_	_
cen-105	213	4	cen	DocumentLevelChargeReasonCode	codeItemType	Document level charge reason code	The reason for the document level charge, expressed as a code.	_	_
cenG-22	214	3	cen	DOCUMENT_TOTALS	_	DOCUMENT TOTALS	A group of business terms providing the monetary totals for the Invoice.	_	_
cen-106	215	4	cen	SumOfInvoiceLineNetAmount	amountItemType	Sum of Invoice line net amount	Sum of all Invoice line net amounts in the Invoice.		
cen-107	216	4	cen	SumOfAllowancesOnDocumentLevel	amountItemType	Sum of allowances on document level	Sum of all allowances on document level in the Invoice.	_	_
cen-108	217	4	cen	SumOfChargesOnDocumentLevel	amountItemType	Sum of charges on document level	Sum of all charges on document level in the Invoice.	_	_
cen-109	218	4	cen	InvoiceTotalAmountWithoutVAT	amountItemType	Invoice total amount without VAT	The total amount of the Invoice without VAT.	_	_
cen-111	219	4	cen	InvoiceTotalVATAmountInAccountingCurrency	amountItemType	Invoice total VAT amount in accounting currency	The VAT total amount expressed in the accounting currency accepted or required in the country of the Seller.	_	_
cen-112	220	4	cen	InvoiceTotalAmountWithVAT	amountItemType	Invoice total amount with VAT	The total amount of the Invoice with VAT.	_	_
cen-113	221	4	cen	PaidAmount	amountItemType	Paid amount	The sum of amounts which have been paid in advance.	_	_
cen-114	222	4	cen	RoundingAmount	amountItemType	Rounding amount	The amount to be added to the invoice total to round the amount to be paid.	_	_
cen-115	223	4	cen	AmountDueForPayment	amountItemType	Amount due for payment	The outstanding amount that is requested to be paid.	_	_
cenG-23	224	3	cen	VAT_BREAKDOWN	_	VAT BREAKDOWN	A group of business terms providing information about VAT breakdown by different categories, rates and exemption reasons	_	_
cen-116	225	4	cen	VATCategoryTaxableAmount	amountItemType	VAT category taxable amount	Sum of all taxable amounts subject to a specific VAT category code and VAT category rate (if the VAT category rate is applicable].		
cen-117	226	4	cen	VATCategoryTaxAmount	amountItemType	VAT category tax amount	The total VAT amount for a given VAT category.		
cen-118	227	4	cen	VATCategoryCode 	codeItemType	VAT category code 	Coded identification of a VAT category.		
cen-119	228	4	cen	VATCategoryRate	percentageItemType	VAT category rate	The VAT rate, represented as percentage that applies for the relevant VAT category.		
cen-120	229	4	cen	VATExemptionReasonText	textItemType	VAT exemption reason text	A textual statement of the reason why the amount is exempted from VAT or why no VAT is being charged	_	_
cen-121	230	4	cen	VATExemptionReasonCode	codeItemType	VAT exemption reason code	A coded statement of the reason for why the amount is exempted from VAT.	_	_
cenG-24	231	3	cen	ADDITIONAL_SUPPORTING_DOCUMENTS	_	ADDITIONAL SUPPORTING DOCUMENTS	A group of business terms providing information about additional supporting documents substantiating the claims made in the Invoice.	_	_
cen-122	232	4	cen	SupportingDocumentReference	documentReferenceItemType	Supporting document reference	An identifier of the supporting document.	_	_
cen-123	233	4	cen	SupportingDocumentDescription	textItemType	Supporting document description	A description of the supporting document	_	_
cen-124	234	4	cen	ExternalDocumentLocation	textItemType	External document location	The URL (Uniform Resource Locator) that identifies where the external document is located.	_	_
cen-125	235	4	cen	AttachedDocument	binaryobjectItemType	Attached document	An attached document embedded as binary object or sent together with the invoice.	_	_
cen-125a	236	4	cen	AttachedDocumentMimeCode	xbrli:stringItemtype	Attached document Mime code	The mime code of the attached document.	_	_
cen-125b	237	4	cen	AttachedDocumentFilename	xbrli:stringItemtype	Attached document Filename	The file name of the attached document	_	_
cen-8	238	3	cen	ValueAddedTaxPointDateCode	codeItemType	Value added tax point date code	The code of the date when the VAT becomes accountable for the Seller and for the Buyer.	_	_
cen-18	239	3	cen	InvoicedObjectIdentifier	identifierItemType	Invoiced object identifier	An identifier for an object on which the invoice is based, given by the Seller.	_	_
corG-5	240	3	cor	entryDetail	_	Entry Detail	Parent for entry detail	【仕訳明細】	仕訳明細の親タグ。
cor-21	241	4	cor	lineNumber	lineNumberItemType	Line Number	Identifier for a particular entry detail\n	明細行番号	仕訳明細の識別子。
cor-22	242	4	cor	lineNumberCounter	counterItemType	Line Number Counter	Unique reference for the line - a numeric counter	明細行番号カウンタ	明細行の一意なリファレンス　　カウンタ
cen-131	243	4	cen	InvoiceLineNetAmount	amountItemType	Invoice line net amount	The total amount of the Invoice line.		
cenG-26	244	4	cen	INVOICE_LINE_PERIOD	_	INVOICE LINE PERIOD	A group of business terms providing information about the period relevant for the Invoice line.	_	_
cen-134	245	5	cen	linePeriodStartDate	dateItemtype	Invoice line period start date	The date when the Invoice period for this Invoice line starts.	_	_
cen-135	246	5	cen	linePeriodEndDate	dateItemtype	Invoice line period end date	The date when the Invoice period for this Invoice line ends.	_	_
corG-6	247	4	cor	account	_	Account Identifier	Tuple: parent container for account numbers and identifiers. No entry is made here, but each detail line may have multiple accounts assigned to it for reporting in different GAAPs, offsetting accounts in Japan, passing along information to consolidation systems about local versus consolidating accounts, etc. For example, the account 4783HG-QOWI-192837-1000 may be expressed so: \n/account/accountMainID 1000  \n/account/accountMainDescription Cash  \n/account/accountSub/accountSubID 4783HG  \n/account/accountSub/accountSubDescription Department  \n/account/accountSub/accountSubID QOWI  \n/account/accountSub/accountSubDescription Branch  \n/account/accountSub/accountSubID 192837  \n/account/accountSub/accountSubDescription Division	【科目識別子】	タプル。勘定科目番号と識別子の親コンテナ。 ここには記入されないが、個々の明細行は、異なるGAAPでの報告や、日本の見返勘定や、連結勘定科目に対する個別情報の連結会計システムへの伝達などのための、複数の勘定科目を持ちうる。例えば、勘定科目4783HG-QOWI-192837-1000は、次のように表現されうる。\n/account/accountMainID 1000  /account/accountMainDescription Cash  /account/accountSub/accountSubID 4783HG  /account/accountSub/accountSubDescription Department  /account/accountSub/accountSubID QOWI  /account/accountSub/accountSubDescription Branch  /account/accountSub/accountSubID 192837  /account/accountSub/accountSubDescription Division
cor-23	248	5	cor	accountMainID	accountMainIDItemType	Main Account Number	Main account - the code used to identify the accounting bucket the entry has been assigned to. Examples might be 1000 for Cash, 567GAAZ for Sales Expense or Z for tax payments. Identifiers such as department, branch, division, manager, or other modifiers are noted in the Subaccount area. Before needing to post, account is not necessary. Posting to the general ledger almost always requires an entry here.	主勘定科目コード	主勘定科目。仕訳が関連する会計バケットを特定するためのコード。例えば、現金を表す1000、販売費を表す567GAAZ、税を表すZ。\n部門、支店、事業部、マネージャ、その他の識別子は、Subaccount領域に記述される。転記の必要がなければ、勘定科目は必要ではない。総勘定元帳に転記するにはほとんどの場合必要。
cor-24	249	5	cor	accountMainDescription	accountMainDescriptionItemType	Main Account Description	Description of accountMainID - the human readable describer that accompanies the code used in accountMainID	主勘定科目説明	主勘定科目コードの説明。主勘定科目コードとして使用されるコードについての、人が読める記述。
cor-25	250	5	cor	mainAccountType	gl-gen:mainAccountTypeItemType	Account Classification	Account type - FASB Concepts 6 and similar international designs. When xbrlInfo is used to associate other XBRL reporting items, this field is more suited to representing existing systems (audit) than data interchange.	主勘定科目区分	主勘定科目の種別。FASB Concepts 6および、同様の国際的な様式。xbrlInfoが他のXBRL項目と関係付けられる場合、データ交換より現存システム(audit)を示すべき。\n[設定値のリスト]\n(asset：資産)、(liability：負債)、(equity：資本)、(income：収益)、(gain：利得)、(expense：費用)、(loss：損失)、(contr-to-equity：資本増加)、(distr-from-equity：資本減少)、(comprehensive-income：包括利益)、(other：その他) 
cor-26	251	5	cor	mainAccountTypeDescription	mainAccountTypeDescriptionItemType	Account Classification Description	Free format description of the account classification	主勘定科目区分説明	主勘定科目の区分の説明。
cor-27	252	5	cor	parentAccountMainID	parentAccountMainIDItemType	Parent Account Number	Roll up item from child natural account to parent natural account.	親勘定科目コード	子勘定科目から親勘定科目に包み込む科目。
cor-28	253	5	cor	accountPurposeCode	gl-gen:accountPurposeCodeItemType	Purpose of Account	Code related to usage for account aggregate - Consolidating, European, IFRS, Offsetting, Primary, Tax, USGAAP, Japanese, Other. Japanese companies will use this for the tax required offsetting entry. If left blank, assumes default accounting method for company.	勘定科目目的	勘定科目群の使用法を示すコード。連結、European, IFRS, 見返、プライマリ, 税, USGAAP, Japanese,その他。日本企業では、見返仕訳で要求される税務処理に利用するかもしれない。空白の場合、企業の既定の勘定方法とみなす。\n[設定値のリスト]\n(consolidating：連結)、(european：ヨーロッパ)、(ifrs：IFRS)、(offsetting：見返)、(primary：プライマリ)、(tax：税)、(usgaap：US GAAP)、(japanese：日本)、(other：その他)
cor-29	254	5	cor	accountPurposeDescription	accountPurposeDescriptionItemType	Description of Purpose of Account	Description of usage for aggregate account	勘定科目目的説明	勘定科目群の使用法の説明。
cor-30	255	5	cor	accountType	gl-gen:accountTypeItemType	Account Type	Type of account	科目種別	科目の種別。\n[設定値のリスト]\n(account：勘定科目)、(bank：銀行)、(employee：従業員)、(customer：顧客)、(job：ジョブ)、(vendor：仕入先)、(measurable：計測可能物)、(statistical：統計)、(other：その他) 
cor-31	256	5	cor	accountTypeDescription	accountTypeDescriptionItemType	Account Type Description	Free format description of the account type	科目種別説明	科目の種別の説明。
bus-114	257	5	bus	entryAccountingMethod	accountingMethodItemType	Entry Accounting Method	For this entry, the method of accounting represented - from: accrual, cash, modified cash, modified accrual, encumbrance, special methods, hybrid methods, other	仕訳会計処理方法	この仕訳の会計処理方法を表す。発生基準、現金基準、修正現金基準、修正発生基準、債務基準、特別な方法、混合方法、その他\n[設定値のリスト]\n(accrual：発生基準)、(cash：現金基準)、(modified cash：修正現金基準)、(modified accrual：修正発生基準)、(encumbrance：債務基準)、(special methods：特別な方法)、(hybrid methods：混合方法)、(other：その他)\n
bus-115	258	5	bus	entryAccountingMethodDescription	entryAccountingMethodDescriptionItemType	Entry Accounting Method Description	Free format description of the entry accounting method	仕訳会計処理方法説明	仕訳の会計処理方法の説明。
bus-116	259	5	bus	entryAccountingMethodPurpose	accountingMethodPurposeItemType	Entry Accounting Method Purpose	For this entry, the reporting purpose represented - from book, tax, management, statutory, other	仕訳会計処理方法目的	仕訳の報告の目的を表す。帳簿、税、管理、スタチュトリ、その他\n[設定値のリスト]\n(book：帳簿)、(tax：税)、(management：管理)、(statutory：スタチュトリ)、(other：その他)\n
bus-117	260	5	bus	entryAccountingMethodPurposeDescription	entryAccountingMethodPurposeDescriptionItemType	Entry Accounting Method Purpose Description	Free format description of the entry accounting method purpose	仕訳会計処理方法目的説明	仕訳の会計処理方法の目的の説明。
corG-7	261	5	cor	accountSub	_	Subaccount Information	Tuple to hold multiple accountSubIDs and Descriptions	【サブ科目情報】	複数のaccountSubIDと説明文を含むタプル。
cor-32	262	6	cor	accountSubDescription	accountSubDescriptionItemType	Subaccount Description	The description that accompanies accountSubID belongs here.	サブ科目説明	accountSubIDに関する説明。
cor-33	263	6	cor	accountSubID	accountSubIDItemType	Subaccount	Where the primary account was placed in accountMainID, the code used for each profit center, division, business unit, fund, program, branch, project, class, su-class or other modifier is placed here.	サブ科目コード	主勘定科目をaccountMainIDに指定したときに、各プロフィットセンタ、事業部、事業体、基金、プログラム、支店、プロジェクト、クラス、su-クラス又は他の修飾子に使用されるコードはここに指定する。
cor-34	264	6	cor	accountSubType	accountSubTypeItemType	Type of Subaccount	Type of sub-account - profit center, division, business unit, fund, program, branch, project, class, su-class or other modifier is placed here. For example:: Accountability center: Business unit: Class:Department: Project: Fund: Program:Job: Profit center: Branch: Setup class: Division: Unit	サブ科目種別	小勘定科目の種別。プロフィットセンタ、事業部、事業体、基金、プログラム、支店、プロジェクト、クラス、su-クラス又は他の修飾子がここに配置される。 例えば、責任単位、事業単位、クラス、部、プロジェクト、基金、プログラム、ジョブ、プロフィットセンター、支店、セットアップクラス、部門、ユニット\n
corG-8	265	6	cor	segmentParentTuple	_	Segment Parent Information	Tuple for showing the detail necessary to roll up from one segment (type of subaccount) to another.)	【親セグメント情報】	セグメント（小勘定科目の種別）間のロールアップ時に必要な詳細情報を示すタプル。
cor-35	266	7	cor	parentSubaccountCode	parentSubaccountCodeItemType	Parent Subaccount Code	Subaccount NUMBER this subaccount rolls up to - see also subaccount type it rolls up to.	親サブ科目コード	この小勘定科目のロールアップ先の小勘定科目の番号-ロールアップ先の小勘定科目の種別も参照。
cor-36	267	7	cor	parentSubaccountType	parentSubaccountTypeItemType	Parent Subaccount Type	The describer of the segment this subaccount rolls up to.	親サブ科目種別	この小勘定科目のロールアップ先のセグメントの説明。
cor-37	268	7	cor	reportingTreeIdentifier	reportingTreeIdentifierItemType	Reporting Tree Identifier	Used for representing descriptions of reporting trees.	報告系統識別子	報告系統の説明に使用される。
cor-38	269	7	cor	parentSubaccountProportion	parentSubaccountProportionItemType	Parent Subaccount Percentage	For partial allocations of amounts to different parents, the percentage of a child that will be allocated to a parent.	親サブ科目配分パーセンテージ	異なる親科目に配分する場合に、親科目に割り当てるパーセンテージ。
cor-39	270	5	cor	accountActive	gl-gen:activeItemType	Account Active	Boolean to indicate whether the account is active (="true") or inactive (="false")	科目有効性	科目が有効か無効かを示すブール値。
cor-40	271	4	cor	amount	gl-gen:amountItemType	Monetary Amount	This field (amount) represents the primary monetary amount related to the  subject of the entryDetail line. There is one primary monetary amount per entryDetail structure. It may, for example, represent the amount of one line of a journal entry, the balance on a document, or the extended amount of a line item on an invoice. Amount is not required if detailed entry is used for non-financial work and other elements are populated, in particular measurableQuantity. The amount field is a signed number (either positive or negative itself) and used in conjunction with a separate signOfAmount and a separate debitCreditCode, which together are considered for understanding the monetary amount. The unit of measure is determined by amountCurrency if present, and by the default or home currency if amountCurrency is not present.	金額	entryDetailの代表的な金額を示す。entryDetailごとにひとつの値を持つ。たとえば、仕訳帳の行、残高、請求書の行の金額。明細が会計業務用でなく、measurableQuantityなどの他の要素が設定されている場合は不要。符号付数値であり、金額を解釈するために用意されたsignOfAmountおよびdebitCreditCodeとあわせて使用される。通貨単位はamountCurrencyで決定される。amountCurrencyが指定されない場合は、既定または自国の通貨単位となる。
